id,speaker_nm,conversation_id,reply_to_id,reply_to_nm,timestamp,text,likes,shares,num_comments,cleaned_text,named_entities,sentiment,tokens
1897011873620615263,PamHemphill79,1897011873620615263,0,None,2025-03-04 19:50:50,"Guess where I’m at? 50501 Protest, Boise Idaho!",286,60,21,guess im 50501 protest boise idaho,"[('Boise Idaho', 'PERSON')]",0.0,"[101, 3984, 10047, 28952, 24096, 6186, 23193, 9795, 102]"
1897046821576565018,ctambakis1,1897011873620615263,1897011873620615263,PamHemphill79,2025-03-04 22:09:42,"Love it! Thank you, Pam! ",5,0,0,love thank pam,[],0.78125,"[101, 2293, 4067, 14089, 102]"
1897012326374707546,myweiredworld,1897011873620615263,1897011873620615263,PamHemphill79,2025-03-04 19:52:38,Keep up the good fight!,3,0,0,good fight,[],0.875,"[101, 2204, 2954, 102]"
1897015064756150713,ZachFOCO,1897011873620615263,1897011873620615263,PamHemphill79,2025-03-04 20:03:30,"Hahaha, it's all boomers from California who destroyed Idaho and who already made their millions doing nothing yet will still let future generations starve before giving up one red cent from their home values or social security. 

Boomers truly are the worst generation.",3,0,2,hahaha boomers california destroyed idaho millions doing let future generations starve giving red cent home values social security boomers truly worst generation,"[('Hahaha', 'GPE'), ('California', 'GPE'), ('Idaho', 'GPE'), ('millions', 'CARDINAL'), ('one red cent', 'MONEY')]",-0.15333333333333332,"[101, 5292, 3270, 3270, 8797, 2545, 2662, 3908, 9795, 8817, 2725, 2292, 2925, 8213, 2732, 3726, 3228, 2417, 9358, 2188, 5300, 2591, 3036, 8797, 2545, 5621, 5409, 4245, 102]"
1897019592859599069,PrinzDebbie,1897011873620615263,1897011873620615263,PamHemphill79,2025-03-04 20:21:30,That's awesome,3,0,0,thats awesome,[],1.0,"[101, 2008, 2015, 12476, 102]"
1897026472105402699,PinkFreudHokie,1897011873620615263,1897011873620615263,PamHemphill79,2025-03-04 20:48:50,I need to drive to Boise from Seattle one of these days,3,0,0,need drive boise seattle days,"[('Boise', 'ORG'), ('Seattle', 'GPE')]",0.0,"[101, 2342, 3298, 23193, 5862, 2420, 102]"
1897046342830318055,ErinTyding75794,1897011873620615263,1897011873620615263,PamHemphill79,2025-03-04 22:07:48,Great turn out! Thanks for being there with me!,3,0,0,great turn thanks,[],0.625,"[101, 2307, 2735, 4283, 102]"
1897050518993952854,Muzz1943,1897011873620615263,1897011873620615263,PamHemphill79,2025-03-04 22:24:23,You are a trooper Pam! ,3,0,0,trooper pam,"[('Pam', 'ORG')]",0.0,"[101, 28224, 14089, 102]"
1897015195224170728,ZachFOCO,1897011873620615263,1897011873620615263,PamHemphill79,2025-03-04 20:04:02,"Why are there no young people at these protests. 

Just angry, greedy, white boomers.",1,0,0,young people protests just angry greedy white boomers,[],-0.18333333333333335,"[101, 2402, 2111, 8090, 2074, 4854, 20505, 2317, 8797, 2545, 102]"
1897238527970251097,Mycrazy64212091,1897011873620615263,1897011873620615263,PamHemphill79,2025-03-05 10:51:28,. Keep up the good fight.,0,0,0,good fight,[],0.7,"[101, 2204, 2954, 102]"
1900186954173657390,cocopekoe7,1900186954173657390,0,None,2025-03-13 14:07:28,"50501_socal 
The people are waking up. Every age, every background, everyone can see exactly where we are headed. Keep the billionaires out of our personal information and out of our government",42,25,3,50501socal people waking age background exactly headed billionaires personal information government,[],0.125,"[101, 28952, 24096, 6499, 9289, 2111, 12447, 2287, 4281, 3599, 3753, 22301, 2015, 3167, 2592, 2231, 102]"
1900211952686895582,zeitgeist8888,1900186954173657390,1900186954173657390,cocopekoe7,2025-03-13 15:46:48,Time to say to the orange mf: “You’re fired!”,1,0,0,time say orange mf youre fired,[],0.0,"[101, 2051, 2360, 4589, 1049, 2546, 2115, 2063, 5045, 102]"
1898455460996628505,daviss,1898455460996628505,0,None,2025-03-08 19:27:08,"Now: 50501 protesters are at the Minnesota State Capitol for the second time this week. Today with local senators and city council members. 

“If you voted for a Republican, we don’t hate you! We are thankful you are here!”",268,43,9,50501 protesters minnesota state capitol second time week today local senators city council members voted republican dont hate thankful,"[('50501', 'CARDINAL'), ('Capitol', 'FAC'), ('second', 'ORDINAL'), ('this week', 'DATE'), ('Today', 'DATE'), ('Republican', 'NORP')]",-0.3333333333333333,"[101, 28952, 24096, 13337, 5135, 2110, 9424, 2117, 2051, 2733, 2651, 2334, 10153, 2103, 2473, 2372, 5444, 3951, 2123, 2102, 5223, 18836, 102]"
1898583366804353529,rrUnplugged,1898455460996628505,1898455460996628505,daviss,2025-03-09 03:55:23, “50501” is about the stupidest thing I have ever seen.,0,0,0,50501 stupidest thing seen,"[('50501', 'CARDINAL')]",0.0,"[101, 28952, 24096, 5236, 4355, 2518, 2464, 102]"
1898941295747371433,Michael68394171,1898455460996628505,1898455460996628505,daviss,2025-03-10 03:37:40,Thank You for  standing up and I agree - we need to clean up the fraud that has taken over our government.,2,0,0,thank standing agree need clean fraud taken government,[],0.3666666666666667,"[101, 4067, 3061, 5993, 2342, 4550, 9861, 2579, 2231, 102]"
1898717530044154015,familygolfmn,1898455460996628505,1898455460996628505,daviss,2025-03-09 12:48:30,What group is paying these people?,1,0,1,group paying people,[],0.0,"[101, 2177, 7079, 2111, 102]"
1898748540014190784,R9790246,1898455460996628505,1898455460996628505,daviss,2025-03-09 14:51:43,Thank you for documenting this.,1,0,0,thank documenting,[],0.0,"[101, 4067, 23138, 102]"
1898456472574460021,VaxxedSax,1898455460996628505,1898455460996628505,daviss,2025-03-08 19:31:09,Seems like some shady billionaire funded BS,0,0,2,like shady billionaire funded bs,"[('BS', 'ORG')]",-0.25,"[101, 2066, 22824, 22301, 6787, 18667, 102]"
1898482563183763567,Mrtully5,1898455460996628505,1898455460996628505,daviss,2025-03-08 21:14:49,what are they protesting?,0,0,2,protesting,[],0.0,"[101, 21248, 102]"
1898771811497598998,RobertKaneRip,1898455460996628505,1898455460996628505,daviss,2025-03-09 16:24:11,Are they celebrating a $18 billion surplus to a $6 billion deficit? Celebrating no accountability for their tax dollars?,4,0,0,celebrating 18 billion surplus 6 billion deficit celebrating accountability tax dollars,"[('$18 billion', 'MONEY'), ('$6 billion', 'MONEY')]",0.0,"[101, 12964, 2324, 4551, 15726, 1020, 4551, 15074, 12964, 17842, 4171, 6363, 102]"
1898571266535104588,DirtyLegs1212,1898455460996628505,1898455460996628505,daviss,2025-03-09 03:07:18,The DFL lies,2,0,0,dfl lies,"[('DFL', 'ORG')]",0.0,"[101, 1040, 10258, 3658, 102]"
1900351475445838121,listen_2learn,1900351475445838121,0,None,2025-03-14 01:01:13,Indivisible is working with 50501 to organize nationwide protests on April 5 to fight for their bureaucracy.,127,84,26,indivisible working 50501 organize nationwide protests april 5 fight bureaucracy,"[('50501', 'CARDINAL'), ('April 5', 'DATE')]",0.0,"[101, 27427, 12848, 17417, 3468, 2551, 28952, 24096, 10939, 9053, 8090, 2258, 1019, 2954, 25934, 102]"
1900351503157911867,listen_2learn,1900351475445838121,1900351475445838121,listen_2learn,2025-03-14 01:01:19,"The Indivisible kids are working with their street protest partner 50501 to organize a mass action tentatively on April 5. 

They charged J6ers with commerce crimes because they said businesses in DC were harmed. The protest organizers should be charged with the exact same crimes",3,3,0,indivisible kids working street protest partner 50501 organize mass action tentatively april 5 charged j6ers commerce crimes said businesses dc harmed protest organizers charged exact crimes,"[('Indivisible', 'ORG'), ('50501', 'DATE'), ('April 5', 'DATE'), ('DC', 'GPE')]",0.11666666666666665,"[101, 27427, 12848, 17417, 3468, 4268, 2551, 2395, 6186, 4256, 28952, 24096, 10939, 3742, 2895, 19325, 2258, 1019, 5338, 1046, 2575, 2545, 6236, 6997, 2056, 5661, 5887, 25596, 6186, 18829, 5338, 6635, 6997, 102]"
1900351859702759919,listen_2learn,1900351475445838121,1900351475445838121,listen_2learn,2025-03-14 01:02:44,Linda Sarsour was a leader of the women’s march. She was kicked out for being too radical. She is now affiliated with 50501 and Build the Resistance.,1,2,1,linda sarsour leader womens march kicked radical affiliated 50501 build resistance,"[('Linda Sarsour', 'PERSON'), ('50501', 'CARDINAL')]",0.0,"[101, 8507, 18906, 6499, 3126, 3003, 2308, 2015, 2233, 6476, 7490, 6989, 28952, 24096, 3857, 5012, 102]"
1900352011809239379,listen_2learn,1900351475445838121,1900351475445838121,listen_2learn,2025-03-14 01:03:21,"This is what 50501 and their fellow revolution business members are protesting for:

1. Impeachment of Trump and removal from office. They also mentioned more prosecutions. 
2. Investigation into Elon Musk, DOGE and Trump appointees
3. Reinstatement of rescinded federal DEI",3,1,0,50501 fellow revolution business members protesting 1 impeachment trump removal office mentioned prosecutions 2 investigation elon musk doge trump appointees 3 reinstatement rescinded federal dei,"[('50501', 'CARDINAL'), ('1', 'CARDINAL'), ('Trump', 'ORG'), ('2', 'CARDINAL'), ('Elon Musk', 'PERSON'), ('DOGE', 'ORG'), ('Trump', 'ORG'), ('3', 'CARDINAL'), ('DEI', 'ORG')]",0.5,"[101, 28952, 24096, 3507, 4329, 2449, 2372, 21248, 1015, 17727, 5243, 22729, 8398, 8208, 2436, 3855, 11537, 2015, 1016, 4812, 3449, 2239, 14163, 6711, 3899, 2063, 8398, 16823, 10285, 1017, 19222, 12259, 3672, 24501, 15459, 5732, 2976, 14866, 102]"
1900351907131982269,listen_2learn,1900351475445838121,1900351475445838121,listen_2learn,2025-03-14 01:02:56,Build the Resistance is another group that is organizing the “organic” protests. They are affiliated with the umbrella group 50501.,0,2,0,build resistance group organizing organic protests affiliated umbrella group 50501,"[('50501', 'DATE')]",0.0,"[101, 3857, 5012, 2177, 10863, 7554, 8090, 6989, 12977, 2177, 28952, 24096, 102]"
1900351676726333468,listen_2learn,1900351475445838121,1900351475445838121,listen_2learn,2025-03-14 01:02:01,"@elonmusk should sue the indivisible kids and @FBIDirectorKash should investigate them. Since they claim that the speech that Trump gave on January 6 incited an insurrection, then these two have incited domestic terrorism, regardless if they claim to be nonviolent. 

Indivisible",0,0,0,elonmusk sue indivisible kids fbidirectorkash investigate claim speech trump gave january 6 incited insurrection incited domestic terrorism regardless claim nonviolent indivisible,"[('Trump', 'PERSON'), ('January 6', 'DATE'), ('two', 'CARDINAL')]",0.2,"[101, 3449, 2239, 7606, 2243, 9790, 27427, 12848, 17417, 3468, 4268, 8495, 4305, 2890, 16761, 13716, 2232, 8556, 4366, 4613, 8398, 2435, 2254, 1020, 4297, 17572, 27860, 4297, 17572, 4968, 10130, 7539, 4366, 2512, 25500, 16136, 27427, 12848, 17417, 3468, 102]"
1900351797253882008,listen_2learn,1900351475445838121,1900351475445838121,listen_2learn,2025-03-14 01:02:29,"The Indivisible kids are working with their street protest partner 50501 to organize a mass action tentatively on April 5. 

They charged J6ers with commerce crimes because they said businesses in DC were harmed. The protest organizers should be charged with the exact same crimes",0,0,0,indivisible kids working street protest partner 50501 organize mass action tentatively april 5 charged j6ers commerce crimes said businesses dc harmed protest organizers charged exact crimes,"[('Indivisible', 'ORG'), ('50501', 'DATE'), ('April 5', 'DATE'), ('DC', 'GPE')]",0.11666666666666665,"[101, 27427, 12848, 17417, 3468, 4268, 2551, 2395, 6186, 4256, 28952, 24096, 10939, 3742, 2895, 19325, 2258, 1019, 5338, 1046, 2575, 2545, 6236, 6997, 2056, 5661, 5887, 25596, 6186, 18829, 5338, 6635, 6997, 102]"
1900354959599624339,sater_terry,1900351475445838121,1900351475445838121,listen_2learn,2025-03-14 01:15:03,"The idea of Indivisible teaming up with 50501 to stage nationwide protests on April 5, 2025, against the Trump administration’s efforts to secure borders, clean up streets, stabilize the economy, and slash waste, fraud, and abuse is a masterclass in self-defeating lunacy. Here’s",4,1,0,idea indivisible teaming 50501 stage nationwide protests april 5 2025 trump administrations efforts secure borders clean streets stabilize economy slash waste fraud abuse masterclass selfdefeating lunacy heres,"[('Indivisible', 'WORK_OF_ART'), ('50501', 'CARDINAL'), ('April 5, 2025', 'DATE'), ('Trump', 'PERSON')]",0.18888888888888888,"[101, 2801, 27427, 12848, 17417, 3468, 27025, 28952, 24096, 2754, 9053, 8090, 2258, 1019, 16798, 2629, 8398, 27722, 4073, 5851, 6645, 4550, 4534, 27790, 4610, 18296, 5949, 9861, 6905, 3040, 26266, 2969, 3207, 7959, 5844, 12909, 5666, 2182, 2015, 102]"
1900373229673259511,MickeyBitcoin,1900351475445838121,1900351475445838121,listen_2learn,2025-03-14 02:27:39,Please join our movement to expand government waste and fraud.,3,0,0,join movement expand government waste fraud,[],-0.2,"[101, 3693, 2929, 7818, 2231, 5949, 9861, 102]"
1900728524664631348,phyllisdawn1982,1900351475445838121,1900351475445838121,listen_2learn,2025-03-15 01:59:28,"Nothing like protesting for bigger government waste fraud and abuse 
The people are believing all the Politicians  who are lying to keep their Grifts",3,0,0,like protesting bigger government waste fraud abuse people believing politicians lying grifts,"[('Politicians', 'NORP'), ('Grifts', 'ORG')]",-0.1,"[101, 2066, 21248, 7046, 2231, 5949, 9861, 6905, 2111, 8929, 8801, 4688, 24665, 10128, 3215, 102]"
1902752440354533423,Wait_ItsThatGuy,1900351475445838121,1900351475445838121,listen_2learn,2025-03-20 16:01:47,"The left is fighting for their parishioners, deacons and priests that operate within their various churches of government.
They hate democracy and they hate the people.",1,0,0,left fighting parishioners deacons priests operate various churches government hate democracy hate people,[],-0.4,"[101, 2187, 3554, 3583, 3258, 2545, 14845, 2015, 8656, 5452, 2536, 5231, 2231, 5223, 7072, 5223, 2111, 102]"
1900558700814774708,WKortepeter,1900351475445838121,1900351475445838121,listen_2learn,2025-03-14 14:44:39,So they want to “resist” the will of the voters while screaming “hands off our democracy.” ,1,0,2,want resist voters screaming hands democracy,[],0.0,"[101, 2215, 9507, 7206, 7491, 2398, 7072, 102]"
1900584174639096106,Maga25_Trump,1900351475445838121,1900351475445838121,listen_2learn,2025-03-14 16:25:53,These people are CRAZY beyond belief,1,0,0,people crazy belief,[],-0.6,"[101, 2111, 4689, 6772, 102]"
1900357915749548420,America1213_,1900351475445838121,1900351475445838121,listen_2learn,2025-03-14 01:26:48,"@FBI
 @FBIDirectorKash",0,0,0,fbi fbidirectorkash,[],0.0,"[101, 8495, 8495, 4305, 2890, 16761, 13716, 2232, 102]"
1900358890937778345,PennyFarringt14,1900351475445838121,1900351475445838121,listen_2learn,2025-03-14 01:30:41,"Sad that this loon has no idea what is really happening...she has bought into the wild Dem stories....these people need to be held accountable if they act upon this treasonous act...she likes waste, fraud and abuse in the government? She must be benefitting from the corrupt money",0,0,0,sad loon idea really happeningshe bought wild dem storiesthese people need held accountable act treasonous actshe likes waste fraud abuse government benefitting corrupt money,"[('Dem', 'NORP')]",-0.18,"[101, 6517, 8840, 2239, 2801, 2428, 6230, 4095, 2063, 4149, 3748, 17183, 3441, 24138, 2063, 2111, 2342, 2218, 26771, 2552, 14712, 3560, 4490, 5369, 7777, 5949, 9861, 6905, 2231, 5770, 3436, 13593, 2769, 102]"
1899586807278231907,reddit_lies,1899586807278231907,0,None,2025-03-11 22:22:42,What is r/50501 planning?,858,53,66,r50501 planning,[],0.0,"[101, 1054, 12376, 12376, 2487, 4041, 102]"
1899587925593194653,djcows,1899586807278231907,1899586807278231907,reddit_lies,2025-03-11 22:27:08,"investigate reddit immediately before it's too late 
@FBI
 @SecretService
 @DOGE",26,1,0,investigate reddit immediately late fbi secretservice doge,[],-0.3,"[101, 8556, 2417, 23194, 3202, 2397, 8495, 7800, 2121, 7903, 2063, 3899, 2063, 102]"
1899592340521754665,R89Capital,1899586807278231907,1899586807278231907,reddit_lies,2025-03-11 22:44:41,"""On the ropes"" with his last $300 billion",3,0,0,ropes 300 billion,"[('last $300 billion', 'MONEY')]",0.0,"[101, 14607, 3998, 4551, 102]"
1899587299274379512,StarP4t,1899586807278231907,1899586807278231907,reddit_lies,2025-03-11 22:24:39,"Please investigate Reddit 
@FBI
 and 
@FBIDirectorKash
 .

Reddit is directly tied to tons of calls for violence, is a cesspool of socialist and communist ideology, and China’s tentacles are all over it! 

Reddit is the most important online adversary to freedom and USA past 10 yrs",143,3,3,investigate reddit fbi fbidirectorkash reddit directly tied tons calls violence cesspool socialist communist ideology chinas tentacles reddit important online adversary freedom usa past 10 yrs,"[('Reddit \r\n@FBI', 'ORG'), ('China', 'GPE')]",0.19374999999999998,"[101, 8556, 2417, 23194, 8495, 8495, 4305, 2890, 16761, 13716, 2232, 2417, 23194, 3495, 5079, 6197, 4455, 4808, 8292, 4757, 16869, 6102, 4750, 13165, 2859, 2015, 24719, 2417, 23194, 2590, 3784, 27248, 4071, 3915, 2627, 2184, 1061, 2869, 102]"
1899587890746958054,exposedleftism,1899586807278231907,1899586807278231907,reddit_lies,2025-03-11 22:27:00,They think the richest man in the world who’s best friends with the president is “on the ropes” because of chronically online Redditors…,147,0,4,think richest man world whos best friends president ropes chronically online redditors,[],1.0,"[101, 2228, 18429, 2158, 2088, 2040, 2015, 2190, 2814, 2343, 14607, 11888, 3973, 3784, 2417, 23194, 5668, 102]"
1899589164816883858,Russkiyyshpion,1899586807278231907,1899586807278231907,reddit_lies,2025-03-11 22:32:04,"Is this the new, ""Trump is finished!""
""Elon is on the ropes""",75,2,4,new trump finished elon ropes,"[('Trump', 'PERSON')]",0.17045454545454544,"[101, 2047, 8398, 2736, 3449, 2239, 14607, 102]"
1899592069213274215,FreeSpeechRots,1899586807278231907,1899586807278231907,reddit_lies,2025-03-11 22:43:36,"I'd say this one counts as a thinly veiled call to violence. Same thing as saying ""luigi"" in this context.",75,1,1,id say counts thinly veiled violence thing saying luigi context,[],-0.2,"[101, 8909, 2360, 9294, 4857, 2135, 15562, 2098, 4808, 2518, 3038, 15153, 6123, 102]"
1899588277159829656,nate_hannon,1899586807278231907,1899586807278231907,reddit_lies,2025-03-11 22:28:32,"> vandalizes property and terrorizes owners
> “I can’t believe Elon made us do this”.",46,1,0,vandalizes property terrorizes owners believe elon,[],0.0,"[101, 3158, 9305, 10057, 3200, 7404, 10057, 5608, 2903, 3449, 2239, 102]"
1899587721347186843,JohnMcCloy,1899586807278231907,1899586807278231907,reddit_lies,2025-03-11 22:26:20,You have to love how we have been talking about this forever her they keep this subreddit open..it’s likely all USAID ex employee /Ukranian run.,39,0,1,love talking forever subreddit openits likely usaid ex employee ukranian run,"[('USAID', 'ORG'), ('/Ukranian', 'NORP')]",0.25,"[101, 2293, 3331, 5091, 4942, 5596, 23194, 2330, 12762, 3497, 3915, 3593, 4654, 7904, 2866, 21578, 2319, 2448, 102]"
1899590905717227993,Spyk3O,1899586807278231907,1899586807278231907,reddit_lies,2025-03-11 22:38:59,In case they hadn't noticed Reddit stock value hasn't had a great month,28,0,2,case hadnt noticed reddit stock value great month,"[('Reddit', 'NORP'), ('a great month', 'DATE')]",0.8,"[101, 2553, 2910, 2102, 4384, 2417, 23194, 4518, 3643, 2307, 3204, 102]"
1899588548891734365,nate_hannon,1899586807278231907,1899586807278231907,reddit_lies,2025-03-11 22:29:37,"Then what. What happens after Elon is destitute? They realize his assets won’t be redistributed to them, right?",21,0,0,happens elon destitute realize assets wont redistributed right,"[('Elon', 'ORG')]",0.2857142857142857,"[101, 6433, 3449, 2239, 4078, 3775, 24518, 5382, 7045, 2180, 2102, 2417, 2923, 3089, 8569, 3064, 2157, 102]"
1901058354320904226,GeneforTexas,1901058354320904226,0,None,2025-03-15 23:50:06,"After a long week in Austin, I’m happy to be back in Houston! 

Hate has no place here—our collective power is stronger than any attempt to divide us. 

Proud to stand with the 50501 Movement today at City Hall.",110,8,45,long week austin im happy houston hate place hereour collective power stronger attempt divide proud stand 50501 movement today city hall,"[('a long week', 'DATE'), ('Austin', 'GPE'), ('Houston', 'GPE'), ('Proud', 'PERSON'), ('the 50501 Movement', 'ORG'), ('today', 'DATE'), ('City Hall', 'FAC')]",0.15,"[101, 2146, 2733, 5899, 10047, 3407, 5395, 5223, 2173, 2182, 8162, 7268, 2373, 6428, 3535, 11443, 7098, 3233, 28952, 24096, 2929, 2651, 2103, 2534, 102]"
1901062579478282504,TexasBelle,1901058354320904226,1901058354320904226,GeneforTexas,2025-03-16 00:06:53,That is a sad group of people. Outcasts and ne'er do wells.,9,0,2,sad group people outcasts neer wells,[],-0.5,"[101, 6517, 2177, 2111, 2041, 10526, 2015, 7663, 2099, 7051, 102]"
1901059550175760833,wreckem66,1901058354320904226,1901058354320904226,GeneforTexas,2025-03-15 23:54:51,"Man, now that’s a posse. Collective power there. Pink tube top dude must be 
@GeneforTexas
 good buddy.",7,0,3,man thats posse collective power pink tube dude genefortexas good buddy,"[('@GeneforTexas', 'PRODUCT')]",0.3666666666666667,"[101, 2158, 2008, 2015, 25751, 7268, 2373, 5061, 7270, 12043, 4962, 13028, 10288, 3022, 2204, 8937, 102]"
1901090464180117737,TexusJesus,1901058354320904226,1901058354320904226,GeneforTexas,2025-03-16 01:57:41,"Houston, as a majority, wants nothing to do with these extremist characters, or those who enable them, by allowing them the platform to pretend that their mental state and physical health is in a positive place. In other words, what the fuck is wrong with you?",5,0,2,houston majority wants extremist characters enable allowing platform pretend mental state physical health positive place words fuck wrong,"[('Houston', 'GPE')]",-0.09967532467532468,"[101, 5395, 3484, 4122, 4654, 7913, 23738, 3494, 9585, 4352, 4132, 9811, 5177, 2110, 3558, 2740, 3893, 2173, 2616, 6616, 3308, 102]"
1901067245905752185,varisco89,1901058354320904226,1901058354320904226,GeneforTexas,2025-03-16 00:25:26,Yalls entire group needs 51 50 to be honest,4,0,0,yalls entire group needs 51 50 honest,"[('51 50', 'CARDINAL')]",0.3,"[101, 8038, 12718, 2972, 2177, 3791, 4868, 2753, 7481, 102]"
1901134745469083876,LoanNinja,1901058354320904226,1901058354320904226,GeneforTexas,2025-03-16 04:53:39,These people must hate their A1C levels.,4,0,0,people hate a1c levels,[],-0.8,"[101, 2111, 5223, 17350, 2278, 3798, 102]"
1901071712084431237,Ski_Rich_Burl,1901058354320904226,1901058354320904226,GeneforTexas,2025-03-16 00:43:11," there's a killer on the road
his brain is squirming like a toad",3,0,0,theres killer road brain squirming like toad,[],0.0,"[101, 2045, 2015, 6359, 2346, 4167, 5490, 10179, 27512, 2290, 2066, 21344, 102]"
1901064976753725878,varisco89,1901058354320904226,1901058354320904226,GeneforTexas,2025-03-16 00:16:25,"The only hate I see is what is coming from the Democrat party
我看見一個天使從天而降，手裡拿著無底深淵的鑰匙和一條大鎖鏈。他抓住了龍，就是最初的那條蛇，也就是魔鬼撒但，把他捆綁1000年。天使把他扔進無底深淵裡，把深淵封閉，在上面蓋印，使他",1,0,0,hate coming democrat party 1000,"[('the Democrat party\r\n我看見一個天使從天而降，手裡拿著無底深淵的鑰匙和一條大鎖鏈。他抓住了龍，就是最初的那條蛇，也就是魔鬼撒但，把他捆綁1000年。天使把他扔進無底深淵裡，把深淵封閉，在上面蓋印，使他', 'ORG')]",-0.4,"[101, 5223, 2746, 7672, 2283, 6694, 102]"
1901067834123313382,ThotBuster18,1901058354320904226,1901058354320904226,GeneforTexas,2025-03-16 00:27:46,"Non American “Hate has no place in Huston”

Me(American): OMW",1,0,0,non american hate place huston meamerican omw,"[('Non American', 'ORG'), ('Huston', 'GPE'), ('Me(American', 'NORP'), ('OMW', 'ORG')]",-0.4,"[101, 2512, 2137, 5223, 2173, 15876, 7106, 2033, 14074, 14735, 2078, 18168, 2860, 102]"
1901362565709439353,smarkstrickland,1901058354320904226,1901058354320904226,GeneforTexas,2025-03-16 19:58:55,"Gene Wu, give us the safe word if you need us to rescue you.",1,0,0,gene wu safe word need rescue,"[('Gene Wu', 'PERSON')]",0.5,"[101, 4962, 8814, 3647, 2773, 2342, 5343, 102]"
1901178298295533802,unburdenedman,1901058354320904226,1901058354320904226,GeneforTexas,2025-03-16 07:46:43,Leftists are always ugly because they have terrible wretched souls.,0,0,0,leftists ugly terrible wretched souls,[],-0.85,"[101, 24247, 2015, 9200, 6659, 23277, 29574, 9293, 102]"
1901100790523003130,OilalwaysRises,1901058354320904226,1901058354320904226,GeneforTexas,2025-03-16 02:38:43,Fine line between love and hate .......,0,0,0,fine line love hate,[],0.038888888888888896,"[101, 2986, 2240, 2293, 5223, 102]"
1901072998070972865,LeslieReneeCum1,1901058354320904226,1901058354320904226,GeneforTexas,2025-03-16 00:48:17,Yall look like a bad costume party.,3,0,2,yall look like bad costume party,[],-0.6999999999999998,"[101, 8038, 3363, 2298, 2066, 2919, 9427, 2283, 102]"
1901088280357060908,JudgeElihuSmail,1901058354320904226,1901058354320904226,GeneforTexas,2025-03-16 01:49:01,Darwin’s rejection pile…,3,0,0,darwins rejection pile,"[('Darwin', 'PERSON')]",0.0,"[101, 11534, 2015, 13893, 8632, 102]"
1901068045008712184,Dean_Hodgkins,1901058354320904226,1901058354320904226,GeneforTexas,2025-03-16 00:28:36,What a homely bunch,2,0,1,homely bunch,[],0.0,"[101, 2188, 2135, 9129, 102]"
1901079246929326296,retardedfed,1901058354320904226,1901058354320904226,GeneforTexas,2025-03-16 01:13:07,Freak show,1,0,0,freak,[],0.0,"[101, 11576, 102]"
