id,speaker_nm,conversation_id,reply_to_id,reply_to_nm,timestamp,text,likes,shares,num_comments,cleaned_text,named_entities,sentiment,tokens
1901082761957372020,phviking76,1901079972594266457,1901079972594266457,PamHemphill79,2025-03-16 01:27:05,"Yeah you are a joke.   75 probation federal workers fired in Idaho, and the forest service put a thing to hire 1500 seasonal workers.   Boise needs to fuck off.",2,0,0,yeah joke 75 probation federal workers fired idaho forest service thing hire 1500 seasonal workers boise needs fuck,"[('75', 'CARDINAL'), ('Idaho', 'GPE'), ('1500', 'CARDINAL'), ('seasonal', 'DATE')]",-0.4,"[101, 3398, 8257, 4293, 19703, 2976, 3667, 5045, 9795, 3224, 2326, 2518, 10887, 10347, 12348, 3667, 23193, 3791, 6616, 102]"
1901160065924821312,MartinMc931,1901079972594266457,1901079972594266457,PamHemphill79,2025-03-16 06:34:16,Left MAGA to join the marxists.. you really think you’re fooling anyone ,1,0,1,left maga join marxists really think youre fooling,[],0.1,"[101, 2187, 23848, 2050, 3693, 15511, 2015, 2428, 2228, 2115, 2063, 7966, 2075, 102]"
1901081085770903672,ADONTHEGREAT,1901079972594266457,1901079972594266457,PamHemphill79,2025-03-16 01:20:25,Now that’s a crowd for Idaho.,2,0,0,thats crowd idaho,"[('Idaho', 'LOC')]",0.0,"[101, 2008, 2015, 4306, 9795, 102]"
1901289335955296389,SchulerLis70829,1901079972594266457,1901079972594266457,PamHemphill79,2025-03-16 15:07:56,That is just beautiful honey,1,0,0,just beautiful honey,[],0.85,"[101, 2074, 3376, 6861, 102]"
1897701879343202478,reddit_lies,1897701879343202478,0,None,2025-03-06 17:32:40,"r/50501, despite its commitment to nonviolence, is still upvoting blatant calls to violence.",256,13,11,r50501 despite commitment nonviolence upvoting blatant calls violence,[],-0.5,"[101, 1054, 12376, 12376, 2487, 2750, 8426, 2512, 25500, 22717, 2039, 22994, 2075, 1038, 20051, 4630, 4455, 4808, 102]"
1897702385364951549,IcedViews,1897701879343202478,1897701879343202478,reddit_lies,2025-03-06 17:34:40,"Well, the rules were in for conservative mindset.

Not for their side.",8,0,1,rules conservative mindset,[],0.0,"[101, 3513, 4603, 9273, 3388, 102]"
1897708114037678389,reddit_lies,1897701879343202478,1897701879343202478,reddit_lies,2025-03-06 17:57:26,It's funny how quickly the rules against denying the election results vanished as soon as the left started doing it.,3,0,0,funny quickly rules denying election results vanished soon left started doing,[],0.19444444444444442,"[101, 6057, 2855, 3513, 16039, 2602, 3463, 9955, 2574, 2187, 2318, 2725, 102]"
1897702969996640765,rwordtakes,1897701879343202478,1897701879343202478,reddit_lies,2025-03-06 17:37:00,"It's not going to stop, Reddit is out of control.

The only way serious changes are going to happen is if the FBI gets involved or shareholders start feeling the pain in their portfolios.",9,0,0,going stop reddit control way changes going happen fbi gets involved shareholders start feeling pain portfolios,"[('Reddit', 'GPE'), ('FBI', 'ORG')]",-0.16666666666666666,"[101, 2183, 2644, 2417, 23194, 2491, 2126, 3431, 2183, 4148, 8495, 4152, 2920, 15337, 2707, 3110, 3255, 11103, 2015, 102]"
1897702075967906023,StarSpangledRoy,1897701879343202478,1897701879343202478,reddit_lies,2025-03-06 17:33:27,"I laughed, that's so retarded.",2,0,0,laughed thats retarded,[],-0.050000000000000044,"[101, 4191, 2008, 2015, 2128, 7559, 5732, 102]"
1897703890222481898,En_Senada69,1897701879343202478,1897701879343202478,reddit_lies,2025-03-06 17:40:39,Digg is coming back and is going to have proper moderation. Reddit killed Digg years ago and now Digg is going to kill Reddit.,1,0,0,digg coming going proper moderation reddit killed digg years ago digg going kill reddit,"[('Digg', 'GPE'), ('Digg years ago', 'DATE'), ('Digg', 'GPE')]",-0.06666666666666667,"[101, 10667, 2290, 2746, 2183, 5372, 5549, 8156, 2417, 23194, 2730, 10667, 2290, 2086, 3283, 10667, 2290, 2183, 3102, 2417, 23194, 102]"
1897707662302667067,withcomment,1897701879343202478,1897701879343202478,reddit_lies,2025-03-06 17:55:39,"I posted on there to ""punch a pedo"" and they advised me violence was not tolerated.",0,0,0,posted punch pedo advised violence tolerated,[],0.0,"[101, 6866, 8595, 21877, 3527, 9449, 4808, 25775, 102]"
1897706269974114531,IrishNeb,1897701879343202478,1897701879343202478,reddit_lies,2025-03-06 17:50:07,I have proof reddit moderators are hacking. Also on this sub. Cyberfx is a government worker who has violated th hatch act for 4 years,5,0,1,proof reddit moderators hacking sub cyberfx government worker violated th hatch act 4 years,"[('Cyberfx', 'PERSON'), ('4 years', 'DATE')]",0.0,"[101, 6947, 2417, 23194, 29420, 2015, 23707, 4942, 16941, 2546, 2595, 2231, 7309, 14424, 16215, 11300, 2552, 1018, 2086, 102]"
1897131163413798937,maggieKTVB7,1897131163413798937,0,None,2025-03-05 03:44:51,"BOISE - Hundreds of Idahoans returned to the Idaho State Capitol grounds Tuesday to protest the actions of the Trump administration, marking yet another protest held by the 50501 movement.",105,18,24,boise hundreds idahoans returned idaho state capitol grounds tuesday protest actions trump administration marking protest held 50501 movement,"[('Idahoans', 'NORP'), ('the Idaho State', 'ORG'), ('Capitol', 'FAC'), ('Tuesday', 'DATE'), ('Trump', 'PERSON'), ('50501', 'CARDINAL')]",0.0,"[101, 23193, 5606, 9795, 6962, 2513, 9795, 2110, 9424, 5286, 9857, 6186, 4506, 8398, 3447, 10060, 6186, 2218, 28952, 24096, 2929, 102]"
1897136489164914824,Shell_Cra1g,1897131163413798937,1897131163413798937,maggieKTVB7,2025-03-05 04:06:00,"They must all live in Boise, and not have jobs?",20,0,1,live boise jobs,"[('Boise', 'GPE')]",0.13636363636363635,"[101, 2444, 23193, 5841, 102]"
1897132174102643198,WellitHappened1,1897131163413798937,1897131163413798937,maggieKTVB7,2025-03-05 03:48:51,Crazy they don't have jobs. They always protest in the middle of the day during the week so people who work can't show up to counter protest.,16,0,0,crazy dont jobs protest middle day week people work counter protest,"[('the middle of the day', 'DATE'), ('the week', 'DATE')]",-0.3,"[101, 4689, 2123, 2102, 5841, 6186, 2690, 2154, 2733, 2111, 2147, 4675, 6186, 102]"
1897181126453821896,SP7852438456604,1897131163413798937,1897131163413798937,maggieKTVB7,2025-03-05 07:03:23,They are welcome to go to California. Nice easy drive. Shared values. Beautiful weather. Win win for everyone ,12,0,1,welcome california nice easy drive shared values beautiful weather win win,"[('California', 'GPE')]",0.7138888888888889,"[101, 6160, 2662, 3835, 3733, 3298, 4207, 5300, 3376, 4633, 2663, 2663, 102]"
1897307607381242130,br0nc0blue,1897131163413798937,1897131163413798937,maggieKTVB7,2025-03-05 15:25:58,Not an employed soul in site.,7,0,1,employed soul site,[],0.0,"[101, 4846, 3969, 2609, 102]"
1897319501785633023,idaDru,1897131163413798937,1897131163413798937,maggieKTVB7,2025-03-05 16:13:14,Don't these people have jobs?,4,0,0,dont people jobs,[],0.0,"[101, 2123, 2102, 2111, 5841, 102]"
1897355687430439028,BZsSaloon,1897131163413798937,1897131163413798937,maggieKTVB7,2025-03-05 18:37:01,"Apparently you're unfamiliar with the phrases ""go back to work"" and ""fog a mirror.""",3,0,0,apparently youre unfamiliar phrases work fog mirror,[],0.025,"[101, 4593, 2115, 2063, 16261, 15672, 2147, 9666, 5259, 102]"
1897516965213954540,filmmaker_max,1897131163413798937,1897131163413798937,maggieKTVB7,2025-03-06 05:17:53,What are they protesting exactly?,2,0,0,protesting exactly,[],0.25,"[101, 21248, 3599, 102]"
1897410884806529060,Johnny_G_III,1897131163413798937,1897131163413798937,maggieKTVB7,2025-03-05 22:16:21,Bunch of idiots!,1,0,0,bunch idiots,"[('Bunch', 'NORP')]",-1.0,"[101, 9129, 28781, 102]"
1897644531421511963,GenXSolutions_,1897131163413798937,1897131163413798937,maggieKTVB7,2025-03-06 13:44:47,These people really have nothing to do.,1,0,0,people really,[],0.2,"[101, 2111, 2428, 102]"
1897146310610100586,JubileeJohn777,1897131163413798937,1897131163413798937,maggieKTVB7,2025-03-05 04:45:02,Time for an audit!,0,0,0,time audit,[],0.0,"[101, 2051, 15727, 102]"
1897319511751320022,Patriot_Eagle59,1897131163413798937,1897131163413798937,maggieKTVB7,2025-03-05 16:13:16,"Hundreds showed up, not thousands.  Leftover USAID funds that had to be spent.",3,0,0,hundreds showed thousands leftover usaid funds spent,"[('Hundreds', 'CARDINAL'), ('thousands', 'CARDINAL')]",-0.1,"[101, 5606, 3662, 5190, 2187, 7840, 3915, 3593, 5029, 2985, 102]"
1897266254437867949,hagland_h67020,1897131163413798937,1897131163413798937,maggieKTVB7,2025-03-05 12:41:39,Must be close to the numbers of the Dems in Idaho which is 26%.,2,0,0,close numbers dems idaho 26,"[('Dems', 'NORP'), ('Idaho', 'GPE'), ('26%', 'PERCENT')]",0.0,"[101, 2485, 3616, 17183, 2015, 9795, 2656, 102]"
1897278861882351781,BoiseGuy36,1897131163413798937,1897131163413798937,maggieKTVB7,2025-03-05 13:31:45,"The democrats are finished 

The only thing that the Democrats applauded was the fact that we funded $350 billion for war Ukraine??",2,0,0,democrats finished thing democrats applauded fact funded 350 billion war ukraine,"[('democrats', 'NORP'), ('Democrats', 'NORP'), ('$350 billion', 'MONEY'), ('Ukraine', 'GPE')]",0.0,"[101, 8037, 2736, 2518, 8037, 10439, 17298, 5732, 2755, 6787, 8698, 4551, 2162, 5924, 102]"
1897261537058074939,ID4lifeboy,1897131163413798937,1897131163413798937,maggieKTVB7,2025-03-05 12:22:54,"That’ll help , other than local democrats media mouth pieces, no one will pay attention",1,0,0,thatll help local democrats media mouth pieces pay attention,"[('democrats', 'NORP')]",-0.0625,"[101, 2008, 3363, 2393, 2334, 8037, 2865, 2677, 4109, 3477, 3086, 102]"
1897342784341991677,Idaho_7,1897131163413798937,1897131163413798937,maggieKTVB7,2025-03-05 17:45:45,Complete ignorance on display. As sick as the democrats repulsive display of disrespect for our Nation attending President Donald J Trump’s state of the union address last night.,1,0,0,complete ignorance display sick democrats repulsive display disrespect nation attending president donald j trumps state union address night,"[('democrats', 'NORP'), ('Nation', 'ORG'), ('Donald J', 'PERSON'), ('last night', 'TIME')]",-0.20476190476190478,"[101, 3143, 18173, 4653, 5305, 8037, 16360, 23004, 4653, 4487, 21338, 2229, 5051, 6593, 3842, 7052, 2343, 6221, 1046, 8398, 2015, 2110, 2586, 4769, 2305, 102]"
1897167258960716030,arizona_bonnie,1897167258960716030,0,None,2025-03-05 06:08:16,"AZ State Capitol, standing near the Rose Garden filming the #50501 Protest. Our march wrapped 3 city blocks ",71,25,0,az state capitol standing near rose garden filming 50501 protest march wrapped 3 city blocks,"[('AZ', 'ORG'), ('Capitol', 'ORG'), ('the Rose Garden', 'FAC'), ('3', 'CARDINAL')]",0.35,"[101, 17207, 2110, 9424, 3061, 2379, 3123, 3871, 7467, 28952, 24096, 6186, 2233, 5058, 1017, 2103, 5991, 102]"
1899170138072523023,VoicesOfFlorida,1899170138072523023,0,None,2025-03-10 18:47:00,"Join Political Revolution, 50501, & Voices of Florida for an AMA with Josh Weil, who is running for office in Florida’s 6th Congressional District in a special election.
 https://reddit.com/r/Political_Revolution…

#PoliticalRevolution #50501Movement #VoicesOfFlorida #JoshWeil",0,0,0,join political revolution 50501 voices florida ama josh weil running office floridas 6th congressional district special election politicalrevolution 50501movement voicesofflorida joshweil,"[('Florida', 'GPE'), ('AMA', 'ORG'), ('Josh', 'PERSON'), ('Florida', 'GPE'), ('6th Congressional District', 'LOC'), ('#PoliticalRevolution #', 'MONEY'), ('VoicesOfFlorida', 'PERSON'), ('JoshWeil', 'PERSON')]",0.17857142857142858,"[101, 3693, 2576, 4329, 28952, 24096, 5755, 3516, 25933, 6498, 11417, 2140, 2770, 2436, 3516, 2015, 5351, 7740, 2212, 2569, 2602, 2576, 2890, 6767, 7630, 3508, 28952, 24096, 5302, 3726, 3672, 5755, 7245, 10626, 8524, 6498, 19845, 2140, 102]"
1897093543203921994,reddit_lies,1897093543203921994,0,None,2025-03-05 01:15:21,r/50501 psyching themselves into violence as usual,157,9,17,r50501 psyching violence usual,[],-0.25,"[101, 1054, 12376, 12376, 2487, 8827, 17994, 2075, 4808, 5156, 102]"
1897095645888123104,rwordtakes,1897093543203921994,1897093543203921994,reddit_lies,2025-03-05 01:23:42,"Hilarious how dude is like “I don't know why we're waiting” from his gaming chair.

Reddit has no real leadership or goals, which is why they can never organize.",8,1,1,hilarious dude like dont know waiting gaming chair reddit real leadership goals organize,"[('Reddit', 'GPE')]",0.2,"[101, 26316, 12043, 2066, 2123, 2102, 2113, 3403, 10355, 3242, 2417, 23194, 2613, 4105, 3289, 10939, 102]"
1897094070847332762,LostPants21,1897093543203921994,1897093543203921994,reddit_lies,2025-03-05 01:17:27,What they look like.,8,0,0,look like,[],0.0,"[101, 2298, 2066, 102]"
1897093654600466820,TroyRubert,1897093543203921994,1897093543203921994,reddit_lies,2025-03-05 01:15:48,@FBIDirectorKash,3,0,0,fbidirectorkash,[],0.0,"[101, 8495, 4305, 2890, 16761, 13716, 2232, 102]"
1897100368125026459,RealSalMinella,1897093543203921994,1897093543203921994,reddit_lies,2025-03-05 01:42:28,Horseshoe theory remains undefeated. These people have gone so far left they came out on the other side.,3,0,0,horseshoe theory remains undefeated people gone far left came,[],-0.008333333333333331,"[101, 23449, 3399, 3464, 15188, 2111, 2908, 2521, 2187, 2234, 102]"
1897094655411708143,CocoWierz,1897093543203921994,1897093543203921994,reddit_lies,2025-03-05 01:19:46,should be renamed to 5150,2,0,1,renamed 5150,"[('5150', 'CARDINAL')]",0.0,"[101, 4096, 4868, 12376, 102]"
1897095349061513566,xd3thw1shx,1897093543203921994,1897093543203921994,reddit_lies,2025-03-05 01:22:32,the whole site is losing it.,2,0,0,site losing,[],0.2,"[101, 2609, 3974, 102]"
1897094043609547127,ShadeNoah,1897093543203921994,1897093543203921994,reddit_lies,2025-03-05 01:17:20,This thread glows.,1,0,0,thread glows,[],0.0,"[101, 11689, 8652, 2015, 102]"
1897096144037327017,AnimalL96540663,1897093543203921994,1897093543203921994,reddit_lies,2025-03-05 01:25:41,I always love asking one of these whack jobs to “please define facism without using the word facist.”  Always get this ,1,0,0,love asking whack jobs define facism using word facist,[],0.5,"[101, 2293, 4851, 1059, 3270, 3600, 5841, 9375, 6904, 22987, 2213, 2478, 2773, 6904, 22987, 2102, 102]"
1897095394720649258,PeterMM61,1897093543203921994,1897093543203921994,reddit_lies,2025-03-05 01:22:43,These a-holes aren’t fighting for shit.,0,0,0,aholes arent fighting shit,[],-0.2,"[101, 6289, 29111, 4995, 2102, 3554, 4485, 102]"
1897095473581932921,DakedeRikudo,1897093543203921994,1897093543203921994,reddit_lies,2025-03-05 01:23:01,"2027 will arrive and those basement dwellers will still be asking themselves ""WHY IS NOBODY DOING ANYTHING!?""",0,0,0,2027 arrive basement dwellers asking doing,"[('2027', 'DATE')]",0.0,"[101, 16798, 2581, 7180, 8102, 28857, 4851, 2725, 102]"
1897095921445560447,OtaxCarbon,1897093543203921994,1897093543203921994,reddit_lies,2025-03-05 01:24:48,They then proceed to do absolutely nothing.,0,0,0,proceed absolutely,[],0.2,"[101, 10838, 7078, 102]"
1897110040898888098,NerigalAwatt,1897093543203921994,1897093543203921994,reddit_lies,2025-03-05 02:20:55,Imagine bragging about the 2nd Amendment and pretending to live under fascists tyranny... that's some high level of cognitive dissonance right there.,0,0,0,imagine bragging 2nd amendment pretending live fascists tyranny thats high level cognitive dissonance right,[],0.14551948051948052,"[101, 5674, 23678, 2075, 3416, 7450, 12097, 2444, 14870, 2015, 5939, 5521, 4890, 2008, 2015, 2152, 2504, 10699, 4487, 7092, 6651, 2157, 102]"
1902473522745675919,VoicesOfFlorida,1902473522745675919,0,None,2025-03-19 21:33:28,"We've collected 18 flyers for 50501 protests happening across Florida on 4/5 in:
• Cape Coral
• Day Beach
• Deland
• Key Largo
• Gville
• Hollywood
• Jax
• Miami
• Ocala
• Orlando
• Palm Coast
• Pcola
• Pt St Lucie
• Sarasota
• St Pete
• Tally
• Tampa
• WPB",3,1,1,weve collected 18 flyers 50501 protests happening florida 45 cape coral day beach deland key largo gville hollywood jax miami ocala orlando palm coast pcola pt st lucie sarasota st pete tally tampa wpb,"[('18', 'CARDINAL'), ('50501', 'CARDINAL'), ('Florida', 'GPE'), ('4/5', 'CARDINAL'), ('WPB', 'ORG')]",0.0,"[101, 2057, 3726, 5067, 2324, 16217, 28952, 24096, 8090, 6230, 3516, 3429, 4880, 11034, 2154, 3509, 3972, 5685, 3145, 2474, 18581, 1043, 3077, 5365, 13118, 5631, 1051, 25015, 10108, 5340, 3023, 7473, 6030, 13866, 2358, 28831, 7354, 6499, 2696, 2358, 6969, 19552, 9925, 1059, 2361, 2497, 102]"
