id,speaker_nm,conversation_id,reply_to_id,reply_to_nm,timestamp,text,likes,shares,num_comments,cleaned_text,named_entities,sentiment,tokens,date,extracted_entities,content_category,enhanced_hate_score,virality_score,spike_day,engagement_rank,hate_intensity,hate_keywords_count,reply_chain_depth,spike_cause,spike_top_entities,spike_external_cause,contextual_relevance,is_reply,user_influence,mention_count,hashtag_count,url_count,conversation_size,conversation_centrality
1294262037317480448,mysuroo,1294215940494639106,1294215940494639106,timesofindia,2020-08-14 13:18:10,"Template from Kashmir.

bechaare, berozgaar : certified?

was expecting this from bd, sg & others... 
@rvaidya2000
 @Kaalateetham
 @KiranKS
 @DrlathaC
 @Girishvhp
 @girishalva
 @mauna_adiga
 @PrinceArihan
 @OpIndia_com",10,1,0,template kashmir bechaare berozgaar certified expecting bd sg rvaidya2000 kaalateetham kiranks drlathac girishvhp girishalva maunaadiga princearihan opindiacom,"girishvhp, @girishvhp, girishalva princearihan, expecting others, @kaalateetham, @princearihan, @kiranks, girishvhp girishalva, ('sg &', kashmir, template kashmir, @mauna_adiga, certified expecting, @opindia_com, kaalateetham kiranks, template, 'LOC'), bechaare berozgaar, kaalateetham, iran, @girishalva, @drlathac, 'ORG')], [('Kashmir'",0.0,"[101, 23561, 13329, 2022, 7507, 12069, 2022, 3217, 2480, 3654, 2906, 7378, 8074, 1038, 2094, 22214, 27634, 14326, 3148, 28332, 2692, 10556, 7911, 17389, 22536, 22403, 5705, 2852, 20051, 3270, 2278, 21025, 18774, 2615, 22269, 21025, 18774, 2389, 3567, 5003, 9521, 17190, 3654, 3159, 8486, 4819, 6728, 22254, 20469, 5358, 102]",2020-08-14,"[""[('Kashmir'"", "" 'LOC')"", "" ('sg &'"", "" 'ORG')]"", 'girishvhp', '@girishvhp', 'girishalva princearihan', 'expecting others', '@kaalateetham', '@princearihan', '@kiranks', 'girishvhp girishalva', 'kashmir', 'template kashmir', '@mauna_adiga', 'certified expecting', '@opindia_com', 'kaalateetham kiranks', 'template', 'bechaare berozgaar', 'kaalateetham', 'iran', '@girishalva', '@drlathac']",international,0.0,0.013,0,0.8466981132075472,0.0,0,1,normal_activity,,no_spike,none,1,0.005464283327440962,9,0,0,51,1.0
1294276262421118976,drsurio,1294215940494639106,1294215940494639106,timesofindia,2020-08-14 14:14:42,"The day your paper folds and goes under, there's going to be more celebration than lamentation. 
Is it mandatory to sell one's humanity to become a journalist anywhere, these days?",5,1,0,day paper folds goes theres going celebration lamentation mandatory sell ones humanity journalist days,"('one', become journalist, 'DATE')], journalist anywhere, lamentation mandatory, 'CARDINAL'), paper folds, celebration lamentation, 'DATE'), sell one, the, ('these days', humanity become, [('The day', anywhere days, one humanity, day paper, going celebration, mandatory sell, folds goes, goes going",0.5,"[101, 2154, 3259, 15439, 3632, 2045, 2015, 2183, 7401, 20342, 23436, 10915, 5271, 3924, 8438, 4988, 2420, 102]",2020-08-14,"[""[('The day'"", "" 'DATE')"", "" ('one'"", "" 'CARDINAL')"", "" ('these days'"", "" 'DATE')]"", 'lamentation mandatory', 'become journalist', 'paper folds', 'celebration lamentation', 'anywhere days', 'going celebration', 'journalist anywhere', 'one humanity', 'sell one', 'day paper', 'the', 'humanity become', 'mandatory sell', 'folds goes', 'goes going']",general,0.2,0.008,0,0.824685534591195,0.2,1,1,normal_activity,,no_spike,none,1,0.003345771831825888,0,0,0,51,1.0
1294355241664569344,ArvindMishraIND,1294215940494639106,1294215940494639106,timesofindia,2020-08-14 19:28:32,How riot started??,18,4,0,riot started,"how, riot started, [], riot",0.0,"[101, 11421, 2318, 102]",2020-08-14,"['[]', 'how', 'riot started', 'riot']",protest,0.0,0.03,0,0.8789308176100629,0.0,0,1,normal_activity,,no_spike,none,1,0.005748121227550077,0,0,0,51,1.0
1294641266630840326,smellTheCoffeez,1294215940494639106,1294215940494639106,timesofindia,2020-08-15 14:25:05,"Hahahahah Kashmiri Pandits lost jobs, lives, lands, homes. How many times did they come out on streets and try to murder people?",12,0,2,hahahahah kashmiri pandits lost jobs lives lands homes times did come streets try murder people,"kashmiri pandits, lands homes, lost jobs, jobs lives, hahahahah kashmiri, try murder, homes many, murder, jobs, times come, hahahahah, hahahahah kashmiri pandits, how, pandits lost, murder people, come streets, [], many times, streets try, lives lands",0.5,"[101, 5292, 3270, 3270, 3270, 2232, 13329, 2072, 29331, 2015, 2439, 5841, 3268, 4915, 5014, 2335, 2106, 2272, 4534, 3046, 4028, 2111, 102]",2020-08-15,"['[]', 'kashmiri pandits', 'lands homes', 'lost jobs', 'jobs lives', 'hahahahah kashmiri', 'try murder', 'homes many', 'murder', 'jobs', 'times come', 'hahahahah', 'hahahahah kashmiri pandits', 'how', 'pandits lost', 'murder people', 'come streets', 'many times', 'streets try', 'lives lands']",crime,0.2,0.016,0,0.8577044025157232,0.2,1,1,normal_activity,,no_spike,none,1,0.006738948261897806,0,0,0,51,1.0
1294319930142339078,caseworker7,1294215940494639106,1294215940494639106,timesofindia,2020-08-14 17:08:13,Shitty old strategy to garner sympathy for Muslims and portray them as gullible brainwashed rioters.,9,1,0,shitty old strategy garner sympathy muslims portray gullible brainwashed rioters,"brainwashed rioters, muslims portray, old strategy, shitty, shitty old, riot, gullible brainwashed, [('Muslims', garner sympathy, portray gullible, muslims, 'NORP')], strategy garner, sympathy muslims",0.1,"[101, 28543, 2214, 5656, 18661, 11883, 7486, 17279, 19739, 6894, 3468, 4167, 27283, 11421, 2545, 102]",2020-08-14,"[""[('Muslims'"", "" 'NORP')]"", 'brainwashed rioters', 'muslims portray', 'old strategy', 'shitty old', 'riot', 'gullible brainwashed', 'garner sympathy', 'portray gullible', 'muslims', 'shitty', 'strategy garner', 'sympathy muslims']",protest,0.0,0.012,0,0.8411949685534591,0.0,0,1,normal_activity,,no_spike,none,1,0.0050405810283179475,0,0,0,51,1.0
1294489092458086402,HebbarNaini,1294215940494639106,1294215940494639106,timesofindia,2020-08-15 04:20:24,"Rioting is a job. They get paid for it. 

And whatever WhatsApp list those 4000 Muslim men are in, it paid them before they assembled to riot.

Employment guaranteed for anti India activities.",9,1,0,rioting job paid whatsapp list 4000 muslim men paid assembled riot employment guaranteed anti india activities,"list muslim, muslim men, paid assembled, 'NORP'), india, get paid, 'ORG'), 'CARDINAL'), whatsapp list, riot, 'GPE')], india activities, muslim, assembled riot, ('India', [('WhatsApp', riot employment, men paid, employment guaranteed, paid whatever, rioting, they, whatsapp, job get, rioting job, and, ('Muslim', ('4000'",0.0,"[101, 11421, 2075, 3105, 3825, 2054, 3736, 9397, 2862, 20143, 5152, 2273, 3825, 9240, 11421, 6107, 12361, 3424, 2634, 3450, 102]",2020-08-15,"[""[('WhatsApp'"", "" 'ORG')"", "" ('4000'"", "" 'CARDINAL')"", "" ('Muslim'"", "" 'NORP')"", "" ('India'"", "" 'GPE')]"", 'list muslim', 'muslim men', 'paid assembled', 'india', 'get paid', 'whatsapp list', 'riot', 'india activities', 'muslim', 'assembled riot', 'riot employment', 'men paid', 'employment guaranteed', 'paid whatever', 'rioting', 'they', 'whatsapp', 'job get', 'rioting job', 'and']",protest,0.1,0.012,0,0.8411949685534591,0.1,0,1,normal_activity,,no_spike,none,1,0.0050405810283179475,0,0,0,51,1.0
1294263120123183111,TheBongHead,1294215940494639106,1294215940494639106,timesofindia,2020-08-14 13:22:28,"Take them all to prison, and get them prison employment and free food.",0,0,0,prison prison employment free food,"prison employment, free food, employment free, take, get prison, prison get, take prison, []",0.4,"[101, 3827, 3827, 6107, 2489, 2833, 102]",2020-08-14,"['[]', 'prison employment', 'free food', 'take', 'employment free', 'get prison', 'prison get', 'take prison']",general,0.1,0.0,0,0.2562893081761006,0.1,0,1,normal_activity,,no_spike,none,1,0.020385081012649228,0,0,0,51,1.0
1294307101662117900,santheepnair,1294215940494639106,1294215940494639106,timesofindia,2020-08-14 16:17:14,"There was rampant Corruption during last 70 years of congress rule
Has anyone indulged in violence

What logic police putting forth",6,1,0,rampant corruption 70 years congress rule indulged violence logic police putting forth,"has, what, ('congress', last years, police putting, rampant corruption, violence logic, rule anyone, police, 'DATE'), indulged violence, putting forth, congress rule, logic police, anyone indulged, 'ORG')], corruption last, [('last 70 years', corruption, violence, years congress, there, congress",0.0,"[101, 25883, 7897, 3963, 2086, 3519, 3627, 27427, 5313, 5999, 4808, 7961, 2610, 5128, 5743, 102]",2020-08-14,"[""[('last 70 years'"", "" 'DATE')"", "" ('congress'"", "" 'ORG')]"", 'has', 'what', 'last years', 'police putting', 'rampant corruption', 'violence logic', 'rule anyone', 'police', 'indulged violence', 'putting forth', 'congress rule', 'logic police', 'anyone indulged', 'corruption last', 'corruption', 'violence', 'years congress', 'there', 'congress']",protest,0.4,0.009,0,0.8301886792452831,0.4,2,1,normal_activity,,no_spike,none,1,0.003769474130948903,0,0,0,51,1.0
1294260807396732928,DrKishoreHadal,1294215940494639106,1294215940494639106,timesofindia,2020-08-14 13:13:17,This is usual spin doctoring of the #bangaloreriots as always by the #toi #TimesofIndia to soften the accusations and justify the acts somewhat and shift blame elsewhere. Shame on the news agency.These lumpen elements have enacted a pre planned act.,7,1,0,usual spin doctoring bangaloreriots toi timesofindia soften accusations justify acts somewhat shift blame shame news agencythese lumpen elements enacted pre planned act,"#timesofindia, toi timesofindia, #toi, soften accusations, timesofindia soften, elsewhere shame, shift blame, always toi, lumpen elements, 'CARDINAL'), [('#', somewhat shift, shame, riot, justify acts, #bangaloreriots, these, pre planned, elements enacted, acts somewhat, spin doctoring, planned act, ('#', 'ORG')], ('TimesofIndia'",-0.25,"[101, 5156, 6714, 3460, 2075, 14022, 9488, 3215, 2000, 2072, 2335, 11253, 22254, 2401, 3730, 2368, 13519, 16114, 4490, 5399, 5670, 7499, 9467, 2739, 4034, 24138, 2063, 15116, 2368, 3787, 11955, 3653, 3740, 2552, 102]",2020-08-14,"[""[('#'"", "" 'CARDINAL')"", "" ('#'"", "" 'CARDINAL')"", "" ('TimesofIndia'"", "" 'ORG')]"", '#timesofindia', 'toi timesofindia', '#toi', 'soften accusations', 'timesofindia soften', 'elsewhere shame', 'shift blame', 'always toi', 'lumpen elements', 'somewhat shift', 'shame', 'riot', 'justify acts', '#bangaloreriots', 'these', 'pre planned', 'elements enacted', 'acts somewhat', 'spin doctoring', 'planned act']",protest,0.5,0.01,0,0.835691823899371,0.5,2,1,normal_activity,,no_spike,none,1,0.004193176430071918,0,3,0,51,1.0
1294465328156573697,indiamusings,1294215940494639106,1294215940494639106,timesofindia,2020-08-15 02:45:58,"Why did they riot?.

Poverty never makes you assault others. It makes you think deeply

I pray everyone has jobs, everyone has enough to feed, clothe, and live in dignity. Without this we have failed ourselves collectively. But, what happened in Bengaluru unpardonable ",6,0,0,did riot poverty makes assault makes think deeply pray jobs feed clothe live dignity failed collectively happened bengaluru unpardonable,"deeply pray, never makes, feed clothe, dignity without, clothe live, assault, happened bengaluru, bengaluru, assault others, jobs, riot, 'GPE')], live dignity, collectively happened, pray everyone, makes think, enough feed, but, makes assault, others makes, jobs everyone, [('Bengaluru'",-0.0909090909090909,"[101, 2106, 11421, 5635, 3084, 6101, 3084, 2228, 6171, 11839, 5841, 5438, 8416, 2063, 2444, 13372, 3478, 13643, 3047, 8191, 14129, 4895, 19362, 5280, 3085, 102]",2020-08-15,"[""[('Bengaluru'"", "" 'GPE')]"", 'deeply pray', 'never makes', 'feed clothe', 'dignity without', 'clothe live', 'assault', 'happened bengaluru', 'bengaluru', 'assault others', 'jobs', 'riot', 'live dignity', 'collectively happened', 'pray everyone', 'makes think', 'enough feed', 'but', 'makes assault', 'others makes', 'jobs everyone']",crime,0.2,0.006,0,0.8034591194968553,0.2,0,1,normal_activity,,no_spike,none,1,0.0025422137947380898,0,0,0,51,1.0
1294355150585266182,ArvindMishraIND,1294215940494639106,1294215940494639106,timesofindia,2020-08-14 19:28:10,"So if People don't have job,
They will start set fire on public property???",4,1,0,people dont job start set public property,"job start, fire public, people job, they, people, public property, set fire, start set, []",0.0,"[101, 2111, 2123, 2102, 3105, 2707, 2275, 2270, 3200, 102]",2020-08-14,"['[]', 'job start', 'fire public', 'they', 'people job', 'people', 'public property', 'set fire', 'start set']",general,0.0,0.007,0,0.8160377358490566,0.0,0,1,normal_activity,,no_spike,none,1,0.005748121227550077,0,0,0,51,1.0
1294253376528474112,swamingiri,1294215940494639106,1294215940494639106,timesofindia,2020-08-14 12:43:45,"Dated old excuse , like poor head-master's son blah , blah .
Never expected from Karnataka Police under BJP govt.",3,1,1,dated old excuse like poor headmasters son blah blah expected karnataka police bjp govt,"dated, bjp govt, karnataka police, excuse like, blah never, dated old, 'ORG'), police bjp, blah blah, police, poor son, ('BJP', never, bjp, [('Karnataka Police', expected karnataka, like poor, son blah, karnataka, 'ORG')], never expected, old excuse",-0.075,"[101, 6052, 2214, 8016, 2066, 3532, 16296, 2015, 2365, 27984, 27984, 3517, 12092, 2610, 24954, 22410, 102]",2020-08-14,"[""[('Karnataka Police'"", "" 'ORG')"", "" ('BJP'"", "" 'ORG')]"", 'dated', 'bjp', 'never expected', 'old excuse', 'blah blah', 'bjp govt', 'police', 'poor son', 'expected karnataka', 'karnataka police', 'never', 'excuse like', 'like poor', 'dated old', 'blah never', 'son blah', 'police bjp', 'karnataka']",protest,0.1,0.008,0,0.824685534591195,0.1,0,1,normal_activity,,no_spike,none,1,0.0033256275697906715,0,0,0,51,1.0
1294854796063645696,saur_ud,1294215940494639106,1294215940494639106,timesofindia,2020-08-16 04:33:35,So they have liberty of burning a city?,1,0,0,liberty burning city,"burning city, liberty burning, []",0.0,"[101, 7044, 5255, 2103, 102]",2020-08-16,"['[]', 'burning city', 'liberty burning']",general,0.2,0.001,0,0.5786163522012578,0.2,1,1,normal_activity,,no_spike,none,1,0.00042370229912301496,0,0,0,51,1.0
1294594918204108800,calm_se_kaam_,1294215940494639106,1294215940494639106,timesofindia,2020-08-15 11:20:55,Ram bhakts took all their jobs and gf's that's why ,1,0,0,ram bhakts took jobs gfs thats,"ram bhakts, jobs, bhakts took, took jobs, ram, []",0.0,"[101, 8223, 1038, 20459, 3215, 2165, 5841, 1043, 10343, 2008, 2015, 102]",2020-08-15,"['[]', 'ram bhakts', 'jobs', 'bhakts took', 'took jobs', 'ram']",economy,0.1,0.001,0,0.5786163522012578,0.1,0,1,normal_activity,,no_spike,none,1,0.00042370229912301496,0,0,0,51,1.0
1294699310190170117,harry5929,1294215940494639106,1294215940494639106,timesofindia,2020-08-15 18:15:44,"#Shame on those who twist the truth, like this.
What does unemployment got to do with Riots?
Should all those UNEMPLOYED must be rioting?",1,0,0,shame twist truth like does unemployment got riots unemployed rioting,"what, got riots, riots unemployed, #shame, 'PERSON')], shame, riot, must rioting, [('Shame', should, truth like, like unemployment, unemployment, ('Riots', shame twist, unemployed, unemployed must, unemployment got, 'PERSON'), riots, twist truth",0.0,"[101, 9467, 9792, 3606, 2066, 2515, 12163, 2288, 12925, 18787, 11421, 2075, 102]",2020-08-15,"[""[('Shame'"", "" 'PERSON')"", "" ('Riots'"", "" 'PERSON')]"", 'shame twist', 'what', 'unemployed', 'got riots', 'unemployed must', 'should', 'riots unemployed', '#shame', 'unemployment got', 'shame', 'truth like', 'like unemployment', 'riot', 'unemployment', 'riots', 'twist truth', 'must rioting']",protest,0.30000000000000004,0.001,0,0.5786163522012578,0.30000000000000004,1,1,normal_activity,,no_spike,none,1,0.00042370229912301496,0,1,0,51,1.0
1294666463341449217,enlightened_so,1294215940494639106,1294215940494639106,timesofindia,2020-08-15 16:05:13,"Yea ! so true .. only in Bengalaru people have lost their jobs and are now poor. Otherwise, rest of the world is full of employed and living with prosperity and very happy. Wow ! 
@timesofindia
. What a fool you make of yourself! Do u have any sensible editors and reporters?? Shame",1,0,0,yea true bengalaru people lost jobs poor rest world employed living prosperity happy wow timesofindia fool make u sensible editors reporters shame,"timesofindia fool, what, happy wow, yea true, employed living, @timesofindia, lost jobs, jobs poor, poor otherwise, prosperity happy, otherwise, bengalaru, people lost, shame, make sensible, jobs, world full, otherwise rest, fool make, editors reporters, [('Bengalaru', 'NORP')]",0.2427083333333333,"[101, 6300, 2050, 2995, 8191, 15728, 2111, 2439, 5841, 3532, 2717, 2088, 4846, 2542, 14165, 3407, 10166, 2335, 11253, 22254, 2401, 7966, 2191, 1057, 21082, 10195, 12060, 9467, 102]",2020-08-15,"[""[('Bengalaru'"", "" 'NORP')]"", 'timesofindia fool', 'what', 'happy wow', 'yea true', 'employed living', '@timesofindia', 'lost jobs', 'jobs poor', 'poor otherwise', 'prosperity happy', 'otherwise', 'bengalaru', 'people lost', 'shame', 'make sensible', 'jobs', 'world full', 'otherwise rest', 'fool make', 'editors reporters']",economy,0.15,0.001,0,0.5786163522012578,0.15,0,1,normal_activity,,no_spike,none,1,0.00042370229912301496,1,0,0,51,1.0
1294353448066924544,TheGoan19,1294215940494639106,1294215940494639106,timesofindia,2020-08-14 19:21:24,"Hey TOI, 
I am currently jobless. 
Please suggest a suitable place for me to follow their example! 
Also,we didn't know that only Chuslims are jobless in India",1,0,0,hey toi currently jobless suggest suitable place follow example alsowe didnt know chuslims jobless india,"jobless please, 'PRODUCT'), also know, also, example also, india, 'ORG'), please suggest, ('Chuslims', place follow, chuslims jobless, 'GPE')], [('TOI', currently jobless, ('India', suggest suitable, hey toi, chuslims, follow example, know chuslims, toi, please, toi currently, suitable place, hey, jobless india",0.2291666666666666,"[101, 4931, 2000, 2072, 2747, 3105, 3238, 6592, 7218, 2173, 3582, 2742, 2036, 8545, 2134, 2102, 2113, 14684, 14540, 5714, 2015, 3105, 3238, 2634, 102]",2020-08-14,"[""[('TOI'"", "" 'ORG')"", "" ('Chuslims'"", "" 'PRODUCT')"", "" ('India'"", "" 'GPE')]"", 'jobless please', 'also know', 'also', 'example also', 'india', 'please suggest', 'place follow', 'chuslims jobless', 'jobless india', 'suggest suitable', 'hey toi', 'chuslims', 'follow example', 'know chuslims', 'toi', 'please', 'toi currently', 'suitable place', 'hey', 'currently jobless']",general,0.05,0.001,0,0.5786163522012578,0.05,0,1,normal_activity,,no_spike,none,1,0.00042370229912301496,0,0,0,51,1.0
1294305396144758787,Madhurijini1,1294215940494639106,1294215940494639106,timesofindia,2020-08-14 16:10:28,"Ohh really...they had jobs.. puncture wala lost job.. हमेशा गाड़िया जलाई है तो job तो जाएगा ही । गाड़ी नहीं तो tyre नहीं,puncture भी नहीं  big loss... well freebies don't need job..Allah gives kids ..to.. rest can be easily given byAllah or tax payers ...is no issue ..",1,0,0,ohh reallythey jobs puncture wala lost job job tyre puncture big loss freebies dont need joballah gives kids rest easily given byallah tax payers issue,"job job, jobs puncture, rest easily, allah gives, kids rest, 'PERSON')], wala lost, loss well, jobs, puncture wala, allah, well freebies, tyre puncture, given byallah, ohh, easily given, byallah, byallah tax, ohh really, tax payers, freebies need, [('गाड़ी', ('byAllah', 'PERSON')",0.2166666666666666,"[101, 2821, 2232, 2428, 10760, 2100, 5841, 26136, 14890, 24547, 2050, 2439, 3105, 3105, 21904, 26136, 14890, 2502, 3279, 2489, 20536, 2123, 2102, 2342, 3105, 25425, 2232, 3957, 4268, 2717, 4089, 2445, 2011, 25425, 2232, 4171, 3477, 2545, 3277, 102]",2020-08-14,"[""[('गाड़ी'"", "" 'PERSON')"", "" ('byAllah'"", "" 'PERSON')]"", 'job job', 'jobs puncture', 'rest easily', 'allah gives', 'kids rest', 'wala lost', 'loss well', 'jobs', 'puncture wala', 'allah', 'well freebies', 'tyre puncture', 'given byallah', 'ohh', 'easily given', 'byallah', 'byallah tax', 'ohh really', 'tax payers', 'freebies need']",economy,0.1,0.001,0,0.5786163522012578,0.1,0,1,normal_activity,,no_spike,none,1,0.00042370229912301496,0,0,0,51,1.0
1294356398738821126,halli_kiran,1294215940494639106,1294215940494639106,timesofindia,2020-08-14 19:33:08,"@CPBlr
 @deepolice12 really you guys said so??",1,0,0,cpblr deepolice12 really guys said,"@cpblr, [('@CPBlr\n ', police, cpblr really, 'PERSON')], really guys, guys said, cpblr, @deepolice12",0.2,"[101, 18133, 16558, 2099, 2784, 23518, 2063, 12521, 2428, 4364, 2056, 102]",2020-08-14,"[""[('@CPBlr\\n '"", "" 'PERSON')]"", '@cpblr', 'police', 'cpblr really', 'really guys', 'guys said', 'cpblr', '@deepolice12']",protest,0.1,0.001,0,0.5786163522012578,0.1,0,1,normal_activity,,no_spike,none,1,0.00042370229912301496,2,0,0,51,1.0
1294300748931411973,Sandeep86141376,1294215940494639106,1294215940494639106,timesofindia,2020-08-14 15:52:00,"What a great logic, they don't have job so they thought let us burn the city on a mere reply ? 
Person reply that what he replied only when someone insult his religions otherwise he seems very secular person. Since he celebrated Ram Janam Bhoomi Poojan he became communal?",1,0,0,great logic dont job thought let burn city mere reply person reply replied insult religions secular person celebrated ram janam bhoomi poojan communal,"ram janam bhoomi, logic job, what, insult religions, poojan became, reply person, job thought, replied someone, person reply, [('Ram Janam Bhoomi Poojan', 'PERSON')], since celebrated, otherwise seems, religions otherwise, someone insult, janam bhoomi, became communal, thought let, celebrated ram, let burn, burn city, ram janam",0.1699999999999999,"[101, 2307, 7961, 2123, 2102, 3105, 2245, 2292, 6402, 2103, 8210, 7514, 2711, 7514, 3880, 15301, 11822, 10644, 2711, 6334, 8223, 23341, 2213, 1038, 6806, 20936, 13433, 22918, 2078, 15029, 102]",2020-08-14,"[""[('Ram Janam Bhoomi Poojan'"", "" 'PERSON')]"", 'ram janam bhoomi', 'logic job', 'what', 'insult religions', 'poojan became', 'reply person', 'job thought', 'replied someone', 'person reply', 'since celebrated', 'ram janam', 'otherwise seems', 'religions otherwise', 'someone insult', 'janam bhoomi', 'became communal', 'thought let', 'celebrated ram', 'let burn', 'burn city']",general,0.2,0.001,0,0.5786163522012578,0.2,1,1,normal_activity,,no_spike,none,1,0.00042370229912301496,0,0,0,51,1.0
1294619529130237952,AayeinKonchi,1294215940494639106,1294215940494639106,timesofindia,2020-08-15 12:58:43,Haha. Whitewashing is on. As if they were rioting for food and income.,1,0,0,haha whitewashing rioting food income,"whitewashing, food income, haha whitewashing, whitewashing rioting, riot, rioting food, haha, []",0.2,"[101, 5292, 3270, 2317, 28556, 2075, 11421, 2075, 2833, 3318, 102]",2020-08-15,"['[]', 'whitewashing', 'food income', 'haha whitewashing', 'whitewashing rioting', 'riot', 'rioting food', 'haha']",protest,0.0,0.001,0,0.5786163522012578,0.0,0,1,normal_activity,,no_spike,none,1,0.00042370229912301496,0,0,0,51,1.0
1294287110866788352,Kallurimk,1294215940494639106,1294215940494639106,timesofindia,2020-08-14 14:57:48,"So take their properties, next their organs to pay up, if not death sentence. We dont need bhikaries who cant pay up for their crimes",1,0,0,properties organs pay death sentence dont need bhikaries pay crimes,"need bhikaries, dont need, crime, pay death, organs pay, death sentence, cant pay, pay crimes, next organs, bhikaries cant, properties next, sentence dont, take properties, []",0.0,"[101, 5144, 11595, 3477, 2331, 6251, 2123, 2102, 2342, 1038, 4048, 20224, 2229, 3477, 6997, 102]",2020-08-14,"['[]', 'need bhikaries', 'dont need', 'crime', 'pay death', 'organs pay', 'death sentence', 'cant pay', 'pay crimes', 'next organs', 'bhikaries cant', 'properties next', 'sentence dont', 'take properties']",crime,0.0,0.001,0,0.5786163522012578,0.0,0,1,normal_activity,,no_spike,none,1,0.00042370229912301496,0,0,0,51,1.0
1294536022022184960,SniperRani,1294215940494639106,1294215940494639106,timesofindia,2020-08-15 07:26:53,Next you'll will say they burnt those cars so they could get customer's.,1,0,0,youll say burnt cars customers,"cars could, next say, could get, get customer, burnt cars, say burnt, next, []",0.0,"[101, 2017, 3363, 2360, 11060, 3765, 6304, 102]",2020-08-15,"['[]', 'cars could', 'next say', 'could get', 'get customer', 'burnt cars', 'say burnt', 'next']",general,0.2,0.001,0,0.5786163522012578,0.2,1,1,normal_activity,,no_spike,none,1,0.00042370229912301496,0,0,0,51,1.0
