id,speaker_nm,conversation_id,reply_to_id,reply_to_nm,timestamp,text,likes,shares,num_comments,cleaned_text,named_entities,sentiment,tokens,date,extracted_entities,content_category,enhanced_hate_score,virality_score,spike_day,engagement_rank,hate_intensity,hate_keywords_count,reply_chain_depth,spike_cause,spike_top_entities,spike_external_cause,contextual_relevance,is_reply,user_influence,mention_count,hashtag_count,url_count,conversation_size,conversation_centrality
1293516315009757185,shiptrained,1293253566551879681,1293253566551879681,BangaloreMirror,2020-08-12 11:54:56,"Mobs from which community? Since you have NOT named them, They have to be Islamic mobs. Unless you name and shame culprits, you will not be able to maintain law and order.  Arrest and file charges. Get them to pay from damages.",0,0,0,mobs community named islamic mobs unless shame culprits able maintain law order arrest file charges pay damages,"culprits able, arrest, name shame, maintain law, arrest file, islamic, named islamic, [('Islamic', mobs unless, 'NORP'), unless, file charges, shame culprits, order arrest, 'PERSON')], mobs, ('Arrest', mobs community, able maintain, since named, unless name, they, pay damages, community since",0.225,"[101, 11240, 2015, 2451, 2315, 5499, 11240, 2015, 4983, 9467, 12731, 14277, 14778, 2015, 2583, 5441, 2375, 2344, 6545, 5371, 5571, 3477, 12394, 102]",2020-08-12,"[""[('Islamic'"", "" 'NORP')"", "" ('Arrest'"", "" 'PERSON')]"", 'culprits able', 'arrest', 'name shame', 'maintain law', 'arrest file', 'islamic', 'named islamic', 'mobs unless', 'unless', 'file charges', 'shame culprits', 'order arrest', 'mobs', 'mobs community', 'able maintain', 'since named', 'unless name', 'they', 'pay damages', 'community since']",protest,0.0,0.0,0,0.2562893081761006,0.0,0,2,normal_activity,,no_spike,none,1,0.0,0,0,0,14,0.27450980392156865
1293269545642164224,imvipul18,1293253566551879681,1293253566551879681,BangaloreMirror,2020-08-11 19:34:22,"Muslim Mobs attacked Congress MLA Srinivas Murthy's residence, Clear message to the Congi Chamachaas. You may lick jihaadis Ass. But, when it is the matter of their religion they won't spare anyone",0,0,0,muslim mobs attacked congress mla srinivas murthys residence clear message congi chamachaas lick jihaadis ass matter religion wont spare,"lick jihaadis, matter religion, murthy, clear, religion spare, you, attack, congress mla, clear message, ass matter, residence clear, 'ORG'), message congi, 'PERSON')], mobs, muslim mobs, ('the Congi Chamachaas', jihaadis ass, muslim, spare anyone, srinivas murthy, (""Srinivas Murthy's"", may lick, [('Muslim Mobs', but, ('Congress', ('Clear', 'PERSON')",0.0999999999999999,"[101, 5152, 11240, 2015, 4457, 3519, 18619, 5185, 3490, 12044, 14163, 15265, 7274, 5039, 3154, 4471, 26478, 2072, 15775, 22911, 3270, 3022, 15385, 10147, 3270, 17190, 2015, 4632, 3043, 4676, 2180, 2102, 8622, 102]",2020-08-11,"[""[('Muslim Mobs'"", "" 'ORG')"", "" ('Congress'"", "" 'ORG')"", ' (""Srinivas Murthy\'s""', "" 'PERSON')"", "" ('Clear'"", "" 'ORG')"", "" ('the Congi Chamachaas'"", "" 'PERSON')]"", 'lick jihaadis', 'matter religion', 'murthy', 'clear', 'religion spare', 'you', 'attack', 'congress mla', 'clear message', 'ass matter', 'residence clear', 'message congi', 'mobs', 'muslim mobs', 'jihaadis ass', 'muslim', 'spare anyone', 'srinivas murthy', 'may lick', 'but']",politics,0.2,0.0,0,0.2562893081761006,0.2,1,2,normal_activity,,no_spike,none,1,0.0,0,0,0,14,0.27450980392156865
1293477768584474624,kiranmgosavi,1293253566551879681,1293253566551879681,BangaloreMirror,2020-08-12 09:21:46,Specify the community of mob,0,0,0,specify community mob,"community mob, specify, [], specify community",0.0,"[101, 20648, 2451, 11240, 102]",2020-08-12,"['[]', 'community mob', 'specify', 'specify community']",general,0.0,0.0,0,0.2562893081761006,0.0,0,2,normal_activity,,no_spike,none,1,0.0,0,0,0,14,0.27450980392156865
1293269657114120192,pathaxz,1293253566551879681,1293253566551879681,BangaloreMirror,2020-08-11 19:34:48,Write it as Muslim mob,0,0,0,write muslim mob,"write muslim, muslim mob, muslim, 'NORP')], [('Muslim', write",0.0,"[101, 4339, 5152, 11240, 102]",2020-08-11,"[""[('Muslim'"", "" 'NORP')]"", 'write', 'muslim mob', 'muslim', 'write muslim']",general,0.0,0.0,0,0.2562893081761006,0.0,0,2,normal_activity,,no_spike,none,1,0.0,0,0,0,14,0.27450980392156865
1293269087389233152,Glavset,1293253566551879681,1293253566551879681,BangaloreMirror,2020-08-11 19:32:32,"A communist India, now think about that.",1,0,0,communist india think,"[('India', communist india, india think, 'GPE')], india",0.0,"[101, 4750, 2634, 2228, 102]",2020-08-11,"[""[('India'"", "" 'GPE')]"", 'communist india', 'india think', 'india']",general,0.0,0.001,0,0.5786163522012578,0.0,0,2,normal_activity,,no_spike,none,1,0.00042370229912301496,0,0,0,14,0.27450980392156865
1294317366696742912,Abhiman32317156,1294317366696742912,0,,2020-08-14 16:58:02,"@Wikipedia
 Why is this non-editable - ""2020 Bangalore riots"". This contains wrong informations.",0,0,0,wikipedia noneditable 2020 bangalore riots contains wrong informations,"[('@Wikipedia\n Why', contains wrong, 'CARDINAL'), wikipedia
 why, riots contains, ('2020', bangalore, wrong informations, bangalore riots, 'PERSON')], 'PERSON'), @wikipedia, this, riot, ('Bangalore', wikipedia bangalore",-0.5,"[101, 16948, 3904, 23194, 3085, 12609, 14022, 12925, 3397, 3308, 2592, 2015, 102]",2020-08-14,"[""[('@Wikipedia\\n Why'"", "" 'PERSON')"", "" ('2020'"", "" 'CARDINAL')"", "" ('Bangalore'"", "" 'PERSON')]"", 'contains wrong', 'wikipedia\n why', 'riots contains', 'bangalore', 'wrong informations', 'bangalore riots', '@wikipedia', 'this', 'riot', 'wikipedia bangalore']",protest,0.2,0.0,0,0.2562893081761006,0.2,1,0,normal_activity,,no_spike,none,0,0.0,1,0,0,1,0.0196078431372549
1293393994622222336,thewire_in,1293393994622222336,0,,2020-08-12 03:48:53,A mob reportedly attacked a Congress MLA’s house in Bengaluru on Tuesday night and vandalised a police station. The police fired at the crowd and two people were killed.,414,132,140,mob reportedly attacked congress mlas house bengaluru tuesday night vandalised police station police fired crowd people killed,"tuesday, two people, mob reportedly, attack, reportedly attacked, congress mla, 'TIME'), ('two', police fired, [('Congress', 'GPE'), house bengaluru, ('Bengaluru', bengaluru, 'ORG'), police, tuesday night, 'DATE'), 'CARDINAL')], the, vandalised police, fired crowd, crowd, bengaluru tuesday, attacked congress, crowd two, night vandalised, station police, ('Tuesday', ('night'",-0.2,"[101, 11240, 7283, 4457, 3519, 18619, 2015, 2160, 8191, 14129, 9857, 2305, 3158, 9305, 5084, 2610, 2276, 2610, 5045, 4306, 2111, 2730, 102]",2020-08-12,"[""[('Congress'"", "" 'ORG')"", "" ('Bengaluru'"", "" 'GPE')"", "" ('Tuesday'"", "" 'DATE')"", "" ('night'"", "" 'TIME')"", "" ('two'"", "" 'CARDINAL')]"", 'tuesday', 'two people', 'mob reportedly', 'attack', 'reportedly attacked', 'congress mla', 'police fired', 'house bengaluru', 'bengaluru', 'police', 'tuesday night', 'the', 'vandalised police', 'fired crowd', 'crowd', 'bengaluru tuesday', 'attacked congress', 'crowd two', 'night vandalised', 'station police']",protest,0.4,1.0,0,0.9772012578616353,0.4,2,0,normal_activity,,no_spike,none,0,0.4172275632862694,0,0,0,49,0.9607843137254902
1293564130633236480,ckdsing,1293393994622222336,1293393994622222336,thewire_in,2020-08-12 15:04:56,A mob reportedly? Are you serious?,0,0,0,mob reportedly,"are, reportedly serious, mob reportedly, []",-0.3333333333333333,"[101, 11240, 7283, 102]",2020-08-12,"['[]', 'are', 'reportedly serious', 'mob reportedly']",general,0.0,0.0,0,0.2562893081761006,0.0,0,1,normal_activity,,no_spike,none,1,0.0,0,0,0,49,0.9607843137254902
1293396781925990400,_tamasik_,1293393994622222336,1293393994622222336,thewire_in,2020-08-12 03:59:57,"If it were a Hindu mob, would you have mentioned the religion?",34,1,1,hindu mob mentioned religion,"hindu mob, mentioned religion, hindu, [('Hindu', mob would, 'NORP')], would mentioned",0.0,"[101, 7560, 11240, 3855, 4676, 102]",2020-08-12,"[""[('Hindu'"", "" 'NORP')]"", 'hindu mob', 'mentioned religion', 'hindu', 'mob would', 'would mentioned']",general,0.0,0.039,0,0.889937106918239,0.0,0,1,normal_activity,,no_spike,none,1,0.016460398842604137,0,0,0,49,0.9607843137254902
1293405932106309632,IAmAnky2201,1293393994622222336,1293393994622222336,thewire_in,2020-08-12 04:36:19,"Look at these hypocrites.. if it was a bit related to hindus, they would not have hesitated to mention the religion and wud demonise whole community.",17,0,1,look hypocrites bit related hindus hesitated mention religion wud demonise community,"whole community, mention religion, religion wud, hypocrites bit, wud demonise, look hypocrites, look, bit related, related hindus, hesitated mention, demonise whole, would hesitated, hindus would, []",0.1,"[101, 2298, 1044, 22571, 10085, 28884, 2978, 3141, 18221, 9369, 5254, 4676, 8814, 2094, 5698, 5562, 2451, 102]",2020-08-12,"['[]', 'whole community', 'religion wud', 'wud demonise', 'look', 'bit related', 'related hindus', 'demonise whole', 'hesitated mention', 'mention religion', 'would hesitated', 'hindus would', 'hypocrites bit', 'look hypocrites']",general,0.0,0.019,0,0.8639937106918238,0.0,0,1,normal_activity,,no_spike,none,1,0.008030199421302068,0,0,0,49,0.9607843137254902
1293433242360532994,MJSadiq7,1293393994622222336,1293393994622222336,thewire_in,2020-08-12 06:24:50,"#hangNaveen coz of his untolarablle post against our Master of universe.
#Bengaluru",1,2,0,hangnaveen coz untolarablle post master universe bengaluru,"bengaluru, master universe, universe bengaluru, hangnaveen, 'NORP')], #bengaluru, master, untolarablle post, coz untolarablle, #hangnaveen, [('Bengaluru', post master, hangnaveen coz",0.0,"[101, 6865, 2532, 3726, 2368, 2522, 2480, 19662, 8017, 7875, 6216, 2695, 3040, 5304, 8191, 14129, 102]",2020-08-12,"[""[('Bengaluru'"", "" 'NORP')]"", 'bengaluru', 'master universe', 'universe bengaluru', 'hangnaveen', '#bengaluru', 'master', 'untolarablle post', '#hangnaveen', 'coz untolarablle', 'post master', 'hangnaveen coz']",general,0.4,0.007,0,0.8160377358490566,0.4,2,1,normal_activity,,no_spike,none,1,0.0028782229715446418,0,2,0,49,0.9607843137254902
1293454537143926784,antiwoke47,1293393994622222336,1293393994622222336,thewire_in,2020-08-12 07:49:27,When you don't get to write 'Hindutva' in a news reporting violence,2,1,0,dont write hindutva news reporting violence,"[('Hindutva', write news, hindutva, get write, news reporting, violence, reporting violence, when, 'NORP')]",0.0,"[101, 2123, 2102, 4339, 7560, 9189, 2050, 2739, 7316, 4808, 102]",2020-08-12,"[""[('Hindutva'"", "" 'NORP')]"", 'write news', 'hindutva', 'get write', 'news reporting', 'violence', 'reporting violence', 'when']",protest,0.2,0.005,0,0.7877358490566038,0.2,1,1,normal_activity,,no_spike,none,1,0.0020746649344568434,0,0,0,49,0.9607843137254902
1293394955046551553,codesattu,1293393994622222336,1293393994622222336,thewire_in,2020-08-12 03:52:42,No catchy headlines. Ok Rule No. 1 of Secularism.,4,0,0,catchy headlines ok rule 1 secularism,"secularism, catchy headlines, ok rule no, 'CARDINAL')], [('1', rule secularism, headlines rule",0.5,"[101, 4608, 2100, 19377, 7929, 3627, 1015, 10644, 2964, 102]",2020-08-12,"[""[('1'"", "" 'CARDINAL')]"", 'secularism', 'catchy headlines', 'ok rule no', 'rule secularism', 'headlines rule']",general,0.0,0.004,0,0.7547169811320755,0.0,0,1,normal_activity,,no_spike,none,1,0.0016948091964920598,0,0,0,49,0.9607843137254902
1293421548364132352,Pratima_1130,1293393994622222336,1293393994622222336,thewire_in,2020-08-12 05:38:22,"Such a neutral coverage? Why didn’t you guys something sensationalising for your headline? Or maybe I must be mistaken, because that’s what you regularly do when something blasphemous happen in the Nation.",3,0,0,neutral coverage didnt guys sensationalising headline maybe mistaken thats regularly blasphemous happen nation,"regularly something, neutral coverage, sensationalising headline, happen nation, blasphemous happen, such, guys something, something sensationalising, maybe must, why, nation, headline maybe, mistaken regularly, something blasphemous, must mistaken, [], coverage guys",0.0,"[101, 8699, 6325, 2134, 2102, 4364, 8742, 13911, 2075, 17653, 2672, 13534, 2008, 2015, 5570, 1038, 8523, 8458, 6633, 3560, 4148, 3842, 102]",2020-08-12,"['[]', 'regularly something', 'neutral coverage', 'sensationalising headline', 'something blasphemous', 'blasphemous happen', 'such', 'happen nation', 'guys something', 'something sensationalising', 'maybe must', 'why', 'nation', 'mistaken regularly', 'headline maybe', 'must mistaken', 'coverage guys']",general,0.0,0.003,0,0.7075471698113207,0.0,0,1,normal_activity,,no_spike,none,1,0.0012711068973690449,0,0,0,49,0.9607843137254902
1293632603732553728,Ashwathama_Says,1293393994622222336,1293393994622222336,thewire_in,2020-08-12 19:37:01,"If you cant report the facts correctly.. kindly stop reporting.. 

dekh ye haal h.. @pravj12",1,1,1,report facts correctly kindly stop reporting dekh ye haal h pravj12,"facts correctly, correctly kindly, @pravj12, dekh haal, report facts, reporting dekh, kindly stop, stop reporting, cant report, []",0.6,"[101, 3189, 8866, 11178, 19045, 2644, 7316, 2139, 10023, 6300, 5292, 2389, 1044, 10975, 11431, 3501, 12521, 102]",2020-08-12,"['[]', 'facts correctly', 'correctly kindly', '@pravj12', 'dekh haal', 'report facts', 'reporting dekh', 'kindly stop', 'stop reporting', 'cant report']",general,0.0,0.006,0,0.8034591194968553,0.0,0,1,normal_activity,,no_spike,none,1,0.0024782229715446416,1,0,0,49,0.9607843137254902
1293407057899450368,RajatVe87094277,1293393994622222336,1293393994622222336,thewire_in,2020-08-12 04:40:47,"No religion of mob , surely no chanting also , nice journalism",1,0,0,religion mob surely chanting nice journalism,"chanting also, also nice, nice journalism, surely chanting, mob surely, religion mob, []",0.175,"[101, 4676, 11240, 7543, 22417, 3835, 8083, 102]",2020-08-12,"['[]', 'chanting also', 'also nice', 'nice journalism', 'surely chanting', 'mob surely', 'religion mob']",general,0.0,0.001,0,0.5786163522012578,0.0,0,1,normal_activity,,no_spike,none,1,0.00042370229912301496,0,0,0,49,0.9607843137254902
1293414588575125504,RudraSmiling,1293393994622222336,1293393994622222336,thewire_in,2020-08-12 05:10:43,Siddharth Vardarajan really eats shit for food.,1,0,0,siddharth vardarajan really eats shit food,"really eats, siddharth vardarajan, vardarajan really, [('Siddharth', 'GPE')], eats shit, vardarajan, siddharth, shit food",0.0,"[101, 15765, 25632, 2705, 13075, 25329, 8405, 2428, 20323, 4485, 2833, 102]",2020-08-12,"[""[('Siddharth'"", "" 'GPE')]"", 'really eats', 'siddharth vardarajan', 'shit food', 'eats shit', 'vardarajan', 'siddharth', 'vardarajan really']",general,0.1,0.001,0,0.5786163522012578,0.1,0,1,normal_activity,,no_spike,none,1,0.00042370229912301496,0,0,0,49,0.9607843137254902
1293415324054765568,ArunChaudhary77,1293393994622222336,1293393994622222336,thewire_in,2020-08-12 05:13:38,Hacking and posting derogatory remarks to arouse communal feelings and violence could be potent tools. Awareness initiatives required .,1,0,0,hacking posting derogatory remarks arouse communal feelings violence potent tools awareness initiatives required,"tools awareness, initiatives required, remarks arouse, hacking, hacking posting, communal feelings, war, awareness, posting derogatory, derogatory remarks, feelings violence, potent tools, awareness initiatives, violence, arouse communal, violence could, [], could potent",0.5,"[101, 23707, 14739, 4315, 18170, 7062, 12629, 12098, 15441, 15029, 5346, 4808, 16834, 5906, 7073, 11107, 3223, 102]",2020-08-12,"['[]', 'tools awareness', 'initiatives required', 'remarks arouse', 'hacking', 'hacking posting', 'communal feelings', 'war', 'violence could', 'posting derogatory', 'derogatory remarks', 'feelings violence', 'potent tools', 'awareness initiatives', 'violence', 'arouse communal', 'awareness', 'could potent']",international,0.6000000000000001,0.001,0,0.5786163522012578,0.6000000000000001,3,1,normal_activity,,no_spike,none,1,0.00042370229912301496,0,0,0,49,0.9607843137254902
1293407288267427841,karthic74,1293393994622222336,1293393994622222336,thewire_in,2020-08-12 04:41:42,"Can you explain more in detail about which mob and which MLA etc 
@svaradarajan",1,0,1,explain mob mla svaradarajan,"detail mob, @svaradarajan, explain detail, can, mla etc, etc svaradarajan, 'PERSON')], [('MLA', mla, mob mla",0.5,"[101, 4863, 11240, 18619, 17917, 5400, 25329, 8405, 102]",2020-08-12,"[""[('MLA'"", "" 'PERSON')]"", 'detail mob', '@svaradarajan', 'explain detail', 'can', 'mla etc', 'etc svaradarajan', 'mla', 'mob mla']",general,0.0,0.003,0,0.7075471698113207,0.0,0,1,normal_activity,,no_spike,none,1,0.0012509626353338283,1,0,0,49,0.9607843137254902
1293433418735214593,Crazy_sc_girl,1293393994622222336,1293393994622222336,thewire_in,2020-08-12 06:25:32,Why using such subtle language you use filthy words for hindus for the slightest error....these are rioters not mob ..have fucking guts to say the truth #bengaluruviolence,1,0,0,using subtle language use filthy words hindus slightest errorthese rioters mob fucking guts say truth bengaluruviolence,"slightest error, language use, fucking guts, truth bengaluruviolence, #bengaluruviolence, hindus slightest, say truth, mob fucking, riot, words hindus, filthy words, rioters mob, [], use filthy, error rioters, why, using subtle, violence, subtle language, guts say",-0.4333333333333333,"[101, 2478, 11259, 2653, 2224, 18294, 2616, 18221, 15989, 7561, 24138, 2063, 11421, 2545, 11240, 8239, 18453, 2360, 3606, 8191, 14129, 25500, 22717, 102]",2020-08-12,"['[]', 'slightest error', 'language use', 'fucking guts', 'truth bengaluruviolence', '#bengaluruviolence', 'hindus slightest', 'say truth', 'mob fucking', 'riot', 'words hindus', 'filthy words', 'rioters mob', 'use filthy', 'error rioters', 'why', 'using subtle', 'violence', 'subtle language', 'guts say']",protest,0.4,0.001,0,0.5786163522012578,0.4,2,1,normal_activity,,no_spike,none,1,0.00042370229912301496,0,1,0,49,0.9607843137254902
1293454830376071168,Rishabhshivhar6,1293393994622222336,1293393994622222336,thewire_in,2020-08-12 07:50:37,"Seeing the heading of this article, it seems the focus is on 2 (rioters) of a particular religion who were killed in a police fire and not the riots by a particular religion who burned the whole area in 3-4 hours.
This tells how they are always ready for a riot.
@suryasanjay1997",1,0,0,seeing heading article focus 2 rioters particular religion killed police riots particular religion burned area 34 hours tells ready riot suryasanjay1997,"religion killed, focus rioters, article seems, seeing, area hours, police fire, [('2', 'CARDINAL'), police, hours tells, riot, fire riots, killed police, seems focus, religion burned, ('3-4 hours', 'TIME')], this, ready riot, @suryasanjay1997, whole area, heading article, burned whole, riots particular",0.1066666666666666,"[101, 3773, 5825, 3720, 3579, 1016, 11421, 2545, 3327, 4676, 2730, 2610, 12925, 3327, 4676, 5296, 2181, 4090, 2847, 4136, 3201, 11421, 7505, 16303, 2319, 3900, 2100, 16147, 2683, 2581, 102]",2020-08-12,"[""[('2'"", "" 'CARDINAL')"", "" ('3-4 hours'"", "" 'TIME')]"", 'religion killed', 'focus rioters', 'article seems', 'seeing', 'area hours', 'police fire', 'police', 'hours tells', 'riot', 'fire riots', 'killed police', 'seems focus', 'religion burned', 'this', 'ready riot', '@suryasanjay1997', 'whole area', 'heading article', 'burned whole', 'riots particular']",protest,0.7000000000000001,0.001,0,0.5786163522012578,0.7000000000000001,3,1,normal_activity,,no_spike,none,1,0.00042370229912301496,1,0,0,49,0.9607843137254902
1293538204230889472,praveenv88,1293393994622222336,1293393994622222336,thewire_in,2020-08-12 13:21:55,Your head line is totally wrong,0,0,0,head line totally wrong,"your, [], line totally, totally wrong, head line",-0.5,"[101, 2132, 2240, 6135, 3308, 102]",2020-08-12,"['[]', 'line totally', 'totally wrong', 'head line', 'your']",general,0.2,0.0,0,0.2562893081761006,0.2,0,1,normal_activity,,no_spike,none,1,0.0,0,0,0,49,0.9607843137254902
1293641580402728960,Imarpitsharma_,1293393994622222336,1293393994622222336,thewire_in,2020-08-12 20:12:42,Correction- A muslim mob full of Jihadi’s,0,0,0,correction muslim mob jihadis,"muslim mob, correction, 'PERSON')], full jihadi, ('Jihadi', 'NORP'), mob full, jihadi, [('muslim'",0.35,"[101, 18140, 5152, 11240, 24815, 2483, 102]",2020-08-12,"[""[('muslim'"", "" 'NORP')"", "" ('Jihadi'"", "" 'PERSON')]"", 'muslim mob', 'correction', 'full jihadi', 'mob full', 'jihadi']",general,0.2,0.0,0,0.2562893081761006,0.2,1,1,normal_activity,,no_spike,none,1,0.0,0,0,0,49,0.9607843137254902
1293413767733288961,npbtn1,1293393994622222336,1293393994622222336,thewire_in,2020-08-12 05:07:27,What was the FB post which made people behave like this? Why cant all religions be tolerant about whats said about them. This violence is so stupid. Have dialogue to sort the diff. Religion is man made -live for it- no need to die for it.,0,0,0,fb post people behave like religions tolerant whats said violence stupid dialogue sort diff religion man live need die,"like cant, what, behave like, have, violence stupid, made people, dialogue sort, man made, said violence, cant religions, post made, religion man, this, religion, sort diff, tolerant whats, [], stupid dialogue, made need, why, whats said",-0.3318181818181818,"[101, 1042, 2497, 2695, 2111, 16582, 2066, 11822, 23691, 2054, 2015, 2056, 4808, 5236, 7982, 4066, 4487, 4246, 4676, 2158, 2444, 2342, 3280, 102]",2020-08-12,"['[]', 'like cant', 'what', 'behave like', 'have', 'violence stupid', 'made people', 'dialogue sort', 'man made', 'said violence', 'cant religions', 'post made', 'religion man', 'this', 'religion', 'sort diff', 'tolerant whats', 'stupid dialogue', 'made need', 'why', 'whats said']",protest,0.9,0.0,0,0.2562893081761006,0.9,4,1,normal_activity,,no_spike,none,1,0.0,0,0,0,49,0.9607843137254902
1293571412800675842,sohanbauva,1293393994622222336,1293393994622222336,thewire_in,2020-08-12 15:33:52,A Muslim mob attacked a dalit mla's house should have been the tag line,0,0,0,muslim mob attacked dalit mlas house tag line,"house tag, attacked dalit, ('mla', muslim mob, 'PERSON')], mla house, dalit mla, attack, mob attacked, tag line, 'NORP'), muslim, [('Muslim'",0.0,"[101, 5152, 11240, 4457, 29095, 2102, 18619, 2015, 2160, 6415, 2240, 102]",2020-08-12,"[""[('Muslim'"", "" 'NORP')"", "" ('mla'"", "" 'PERSON')]"", 'house tag', 'attacked dalit', 'muslim mob', 'mla house', 'dalit mla', 'attack', 'mob attacked', 'tag line', 'muslim']",terrorism,0.2,0.0,0,0.2562893081761006,0.2,1,1,normal_activity,,no_spike,none,1,0.0,0,0,0,49,0.9607843137254902
1293705186079211520,Arjun67823486,1293393994622222336,1293393994622222336,thewire_in,2020-08-13 00:25:26,"Ye kya chutiya journalism Hai BSDK wire
mobile.twitter.com/erbmjha/status
…",0,0,0,ye kya chutiya journalism hai bsdk wire mobiletwittercomerbmjhastatus,"chutiya journalism, kya chutiya, [('Hai BSDK', bsdk wire, 'PERSON')], hai, hai bsdk, journalism hai",0.0,"[101, 6300, 18712, 2050, 14684, 3775, 3148, 8083, 15030, 18667, 2094, 2243, 7318, 4684, 2102, 9148, 12079, 9006, 2121, 25526, 3501, 14949, 29336, 2271, 102]",2020-08-13,"[""[('Hai BSDK'"", "" 'PERSON')]"", 'chutiya journalism', 'kya chutiya', 'bsdk wire', 'hai', 'hai bsdk', 'journalism hai']",general,0.0,0.0,0,0.2562893081761006,0.0,0,1,normal_activity,,no_spike,none,1,0.0,0,0,0,49,0.9607843137254902
1293489963481235456,archanavues,1293393994622222336,1293393994622222336,thewire_in,2020-08-12 10:10:13,"""Just Mob?? Come on, there are more elegent ways to defend your precious rioters!"" 
#BengaluruBurns
#Bengalururiots",0,0,0,just mob come elegent ways defend precious rioters bengaluruburns bengalururiots,"bengaluruburns, come, come elegent, defend precious, precious rioters, rioters bengaluruburns, bengaluruburns bengalururiots, ways defend, mob come, 'WORK_OF_ART')], #bengalururiots, [('Just Mob', mob, riot, just mob, elegent ways, #bengaluruburns, bengalururiots",0.5625,"[101, 2074, 11240, 2272, 3449, 24746, 3372, 3971, 6985, 9062, 11421, 2545, 8191, 14129, 8022, 2015, 8191, 14129, 9488, 3215, 102]",2020-08-12,"[""[('Just Mob'"", "" 'WORK_OF_ART')]"", 'bengaluruburns', 'come', 'come elegent', 'defend precious', 'precious rioters', 'rioters bengaluruburns', 'bengaluruburns bengalururiots', 'ways defend', 'mob come', '#bengalururiots', 'mob', 'riot', 'just mob', 'elegent ways', '#bengaluruburns', 'bengalururiots']",protest,0.45,0.0,0,0.2562893081761006,0.45,2,1,normal_activity,,no_spike,none,1,0.0,0,2,0,49,0.9607843137254902
