id,speaker_nm,conversation_id,reply_to_id,reply_to_nm,timestamp,text,likes,shares,num_comments,cleaned_text,named_entities,sentiment,tokens,date,extracted_entities,content_category,enhanced_hate_score,virality_score,spike_day,engagement_rank,hate_intensity,hate_keywords_count,reply_chain_depth,spike_cause,spike_top_entities,spike_external_cause,contextual_relevance,is_reply,user_influence,mention_count,hashtag_count,url_count,conversation_size,conversation_centrality
1293419736588574721,ANI,1293419736588574721,0,,2020-08-12 05:31:10,"Now, situation is completely under control. Curfew imposed in DJ Halli & KG Halli police station limits & Section 144 imposed in remaining city. We are getting some companies from RAF, CRPF & CISF, to  join our security arrangements: Kamal Pant, Bengaluru City Police Commissioner",286,36,17,situation completely control curfew imposed dj halli kg halli police station limits section 144 imposed remaining city getting companies raf crpf cisf join security arrangements kamal pant bengaluru city police commissioner,"control curfew, city getting, ('Section 144', remaining city, companies raf, police commissioner, completely control, cisf join, security, station limits, section imposed, ('CRPF & CISF', 'ORG'), imposed halli, pant bengaluru, police, ('Kamal Pant', crpf, halli halli, security arrangements, curfew imposed, join security, limits section, crpf cisf, [('DJ Halli & KG Halli', ('Bengaluru City Police', 'ORG')], 'PERSON'), 'LAW'), ('RAF'",0.1,"[101, 3663, 3294, 2491, 12731, 12881, 7974, 9770, 6520, 2534, 2072, 4705, 2534, 2072, 2610, 2276, 6537, 2930, 14748, 9770, 3588, 2103, 2893, 3316, 7148, 13675, 14376, 20199, 2546, 3693, 3036, 7565, 21911, 6090, 2102, 8191, 14129, 2103, 2610, 5849, 102]",2020-08-12,"[""[('DJ Halli & KG Halli'"", "" 'ORG')"", "" ('Section 144'"", "" 'LAW')"", "" ('RAF'"", "" 'ORG')"", "" ('CRPF & CISF'"", "" 'ORG')"", "" ('Kamal Pant'"", "" 'PERSON')"", "" ('Bengaluru City Police'"", "" 'ORG')]"", 'control curfew', 'city getting', 'remaining city', 'companies raf', 'police commissioner', 'completely control', 'cisf join', 'security', 'station limits', 'section imposed', 'imposed halli', 'pant bengaluru', 'police', 'crpf', 'halli halli', 'security arrangements', 'curfew imposed', 'join security', 'limits section', 'crpf cisf']",protest,0.6000000000000001,0.428,0,0.9237421383647799,0.6000000000000001,2,1,normal_activity,,no_spike,none,0,0.6207403563259014,0,0,0,10,0.19607843137254902
1293419736588574721,ANI,1293419736588574721,1293419736588574721,ANI,2020-08-12 05:31:10,"Now, situation is completely under control. Curfew imposed in DJ Halli & KG Halli police station limits & Section 144 imposed in remaining city. We are getting some companies from RAF, CRPF & CISF, to  join our security arrangements: Kamal Pant, Bengaluru City Police Commissioner",286,36,17,situation completely control curfew imposed dj halli kg halli police station limits section 144 imposed remaining city getting companies raf crpf cisf join security arrangements kamal pant bengaluru city police commissioner,"control curfew, city getting, ('Section 144', remaining city, companies raf, police commissioner, completely control, cisf join, security, station limits, section imposed, ('CRPF & CISF', 'ORG'), imposed halli, pant bengaluru, police, ('Kamal Pant', crpf, halli halli, security arrangements, curfew imposed, join security, limits section, crpf cisf, [('DJ Halli & KG Halli', ('Bengaluru City Police', 'ORG')], 'PERSON'), 'LAW'), ('RAF'",0.1,"[101, 3663, 3294, 2491, 12731, 12881, 7974, 9770, 6520, 2534, 2072, 4705, 2534, 2072, 2610, 2276, 6537, 2930, 14748, 9770, 3588, 2103, 2893, 3316, 7148, 13675, 14376, 20199, 2546, 3693, 3036, 7565, 21911, 6090, 2102, 8191, 14129, 2103, 2610, 5849, 102]",2020-08-12,"[""[('DJ Halli & KG Halli'"", "" 'ORG')"", "" ('Section 144'"", "" 'LAW')"", "" ('RAF'"", "" 'ORG')"", "" ('CRPF & CISF'"", "" 'ORG')"", "" ('Kamal Pant'"", "" 'PERSON')"", "" ('Bengaluru City Police'"", "" 'ORG')]"", 'control curfew', 'city getting', 'remaining city', 'companies raf', 'police commissioner', 'completely control', 'cisf join', 'security', 'station limits', 'section imposed', 'imposed halli', 'pant bengaluru', 'police', 'crpf', 'halli halli', 'security arrangements', 'curfew imposed', 'join security', 'limits section', 'crpf cisf']",protest,0.6000000000000001,0.428,0,0.9237421383647799,0.6000000000000001,2,1,normal_activity,,no_spike,none,1,0.6207403563259014,0,0,0,10,0.19607843137254902
1293423799543762945,ANI,1293419736588574721,1293419736588574721,ANI,2020-08-12 05:47:19,"Three people have died. Around 60 policemen injured, they've sustained stone injuries. Police vehicles were damaged & set on fire. A group entered a basement area where 200-250 vehicles were set on fire. Investigation on: Kamal Pant, Bengaluru City Police Commissioner",95,39,12,people died 60 policemen injured theyve sustained stone injuries police vehicles damaged set group entered basement area 200250 vehicles set investigation kamal pant bengaluru city police commissioner,"damaged set, group entered, vehicles damaged, policemen injured, ('200', police commissioner, injuries police, 'CARDINAL'), [('Three', around, investigation, people died, stone injuries, pant bengaluru, police, ('Kamal Pant', set fire, basement area, ('60', vehicles set, police vehicles, fire investigation, entered basement, area vehicles, ('Bengaluru City Police', 'ORG')], 'PERSON'), fire group",0.0,"[101, 2111, 2351, 3438, 19809, 5229, 2027, 3726, 8760, 2962, 6441, 2610, 4683, 5591, 2275, 2177, 3133, 8102, 2181, 2526, 12376, 4683, 2275, 4812, 21911, 6090, 2102, 8191, 14129, 2103, 2610, 5849, 102]",2020-08-12,"[""[('Three'"", "" 'CARDINAL')"", "" ('60'"", "" 'CARDINAL')"", "" ('200'"", "" 'CARDINAL')"", "" ('Kamal Pant'"", "" 'PERSON')"", "" ('Bengaluru City Police'"", "" 'ORG')]"", 'damaged set', 'group entered', 'vehicles damaged', 'policemen injured', 'police commissioner', 'injuries police', 'around', 'investigation', 'people died', 'stone injuries', 'pant bengaluru', 'police', 'fire group', 'set fire', 'basement area', 'vehicles set', 'police vehicles', 'fire investigation', 'entered basement', 'area vehicles']",crime,0.2,0.236,0,0.9088050314465409,0.2,1,2,normal_activity,,no_spike,none,1,0.6207403563259014,0,0,0,10,0.19607843137254902
1293421499068477442,BheeshmPitamah,1293419736588574721,1293419736588574721,ANI,2020-08-12 05:38:10,"Bangalore police, You need to do a Yogi here. Drive the rioters out and make them pay for destruction they caused. Attach their damn properties if needed. Put their posters and hoardings on Brigade Road for public at large to see their faces. Enough of this nonsense by the mob.",3,1,1,bangalore police need yogi drive rioters make pay destruction caused attach damn properties needed posters hoardings brigade road public large faces nonsense mob,"caused attach, damn properties, put, needed put, brigade road, posters hoardings, you, drive rioters, rioters make, attach damn, drive, destruction caused, put posters, make pay, public large, large see, police, see faces, riot, properties needed, [('Yogi', ('Brigade Road', 'PERSON'), 'FAC')]",0.0714285714285714,"[101, 14022, 2610, 2342, 10930, 5856, 3298, 11421, 2545, 2191, 3477, 6215, 3303, 22476, 4365, 5144, 2734, 14921, 7570, 29154, 2015, 4250, 2346, 2270, 2312, 5344, 14652, 11240, 102]",2020-08-12,"[""[('Yogi'"", "" 'PERSON')"", "" ('Brigade Road'"", "" 'FAC')]"", 'caused attach', 'damn properties', 'put', 'needed put', 'brigade road', 'posters hoardings', 'you', 'drive rioters', 'rioters make', 'attach damn', 'drive', 'destruction caused', 'put posters', 'make pay', 'public large', 'large see', 'police', 'see faces', 'riot', 'properties needed']",protest,0.2,0.008,0,0.824685534591195,0.2,1,2,normal_activity,,no_spike,none,1,0.0033256275697906715,0,0,0,10,0.19607843137254902
1293459806351552512,Coronavirus010,1293419736588574721,1293419736588574721,ANI,2020-08-12 08:10:23,1st burn public property then play victim card,1,0,0,1st burn public property play victim card,"play victim, burn public, victim, property play, victim card, 'ORDINAL')], public property, [('1st'",-0.0375,"[101, 3083, 6402, 2270, 3200, 2377, 6778, 4003, 102]",2020-08-12,"[""[('1st'"", "" 'ORDINAL')]"", 'play victim', 'burn public', 'victim', 'property play', 'victim card', 'public property']",crime,0.2,0.001,0,0.5786163522012578,0.2,1,2,normal_activity,,no_spike,none,1,0.0003711068973690448,0,0,0,10,0.19607843137254902
1293952289955172352,ManjeshPolo,1293419736588574721,1293419736588574721,ANI,2020-08-13 16:47:21,Dear sir u people are having government job ur having all the rolls and all parmicen but u ppl not tc ur safety n ur shelf means what is the use being a public service y u ppl are having Gan den whom  public HV to believe now a days no hope on police tqu sir,0,0,0,dear sir u people having government job ur having rolls parmicen u ppl tc ur safety n ur shelf means use public service y u ppl having gan den public hv believe days hope police tqu sir,"ppl safety, gan den, hope police, [('Gan', days hope, people government, parmicen ppl, use public, service ppl, public believe, dear, shelf means, means use, police, job rolls, ppl gan, dear sir, police tqu, den public, tqu sir, believe days, ('HV', 'ORG')], 'PERSON')",0.0,"[101, 6203, 2909, 1057, 2111, 2383, 2231, 3105, 24471, 2383, 9372, 11968, 7712, 2368, 1057, 4903, 2140, 22975, 24471, 3808, 1050, 24471, 11142, 2965, 2224, 2270, 2326, 1061, 1057, 4903, 2140, 2383, 25957, 7939, 2270, 1044, 2615, 2903, 2420, 3246, 2610, 28816, 2226, 2909, 102]",2020-08-13,"[""[('Gan'"", "" 'PERSON')"", "" ('HV'"", "" 'ORG')]"", 'ppl safety', 'gan den', 'hope police', 'days hope', 'people government', 'parmicen ppl', 'use public', 'service ppl', 'public believe', 'dear', 'shelf means', 'means use', 'police', 'job rolls', 'ppl gan', 'dear sir', 'police tqu', 'den public', 'tqu sir', 'believe days']",protest,0.1,0.0,0,0.2562893081761006,0.1,0,2,normal_activity,,no_spike,none,1,0.0,0,0,0,10,0.19607843137254902
1293554648264200192,MrX25583346,1293419736588574721,1293419736588574721,ANI,2020-08-12 14:27:15,"Ka 02 G 1297 
Has a traffic signal jump notice",0,0,0,ka 02 g 1297 traffic signal jump notice,"has, traffic signal, 'PERSON')], jump notice, signal jump, [('Ka 02 G 1297'",0.0,"[101, 10556, 6185, 1043, 14378, 2581, 4026, 4742, 5376, 5060, 102]",2020-08-12,"[""[('Ka 02 G 1297'"", "" 'PERSON')]"", 'has', 'signal jump', 'jump notice', 'traffic signal']",general,0.0,0.0,0,0.2562893081761006,0.0,0,2,normal_activity,,no_spike,none,1,0.0,0,0,0,10,0.19607843137254902
1293426699229519873,AKSriva24243482,1293419736588574721,1293419736588574721,ANI,2020-08-12 05:58:50,Encounter all these antinationals and Islamic terrorists immediately.,0,0,0,encounter antinationals islamic terrorists immediately,"islamic terrorists, islamic, terrorist, encounter, [('Islamic', antinationals islamic, terrorists immediately, encounter antinationals, 'NORP')]",0.0,"[101, 8087, 3424, 25434, 2015, 5499, 15554, 3202, 102]",2020-08-12,"[""[('Islamic'"", "" 'NORP')]"", 'islamic terrorists', 'islamic', 'terrorist', 'encounter', 'antinationals islamic', 'terrorists immediately', 'encounter antinationals']",terrorism,0.5,0.0,0,0.2562893081761006,0.5,2,2,normal_activity,,no_spike,none,1,0.0,0,0,0,10,0.19607843137254902
1293479468502142981,KasthuriRajan9,1293419736588574721,1293419736588574721,ANI,2020-08-12 09:28:31,What is the problem there?,0,0,0,problem,"what, []",0.0,"[101, 3291, 102]",2020-08-12,"['[]', 'what']",general,0.0,0.0,0,0.2562893081761006,0.0,0,2,normal_activity,,no_spike,none,1,0.0,0,0,0,10,0.19607843137254902
1293459726026432513,Coronavirus010,1293419736588574721,1293419736588574721,ANI,2020-08-12 08:10:04,Pre planned riot,0,0,0,pre planned riot,"pre, [], riot, planned riot, pre planned",0.0,"[101, 3653, 3740, 11421, 102]",2020-08-12,"['[]', 'planned riot', 'pre', 'pre planned', 'riot']",protest,0.0,0.0,0,0.2562893081761006,0.0,0,2,normal_activity,,no_spike,none,1,0.0003711068973690448,0,0,0,10,0.19607843137254902
1293428997406285825,ANI,1293428997406285825,0,,2020-08-12 06:07:58,"The incident that took place last night is very unfortunate. A lot of damage has been caused to public property. I appeal to all the people of the city not to be provoked or disturbed by this incident: GN Shivamurthy, Deputy Commissioner, Bengaluru Urban. #Karnataka",184,17,14,incident took place night unfortunate lot damage caused public property appeal people city provoked disturbed incident gn shivamurthy deputy commissioner bengaluru urban karnataka,"shivamurthy deputy, place last, caused public, 'NORP'), 'TIME'), city provoked, damage caused, urban karnataka, 'ORG'), ('Bengaluru', #karnataka, property appeal, disturbed incident, appeal people, 'PERSON')], commissioner bengaluru, last night, deputy commissioner, the, people city, took place, night unfortunate, incident took, unfortunate lot, public property, [('last night', ('GN Shivamurthy', ('Karnataka'",-0.1625,"[101, 5043, 2165, 2173, 2305, 15140, 2843, 4053, 3303, 2270, 3200, 5574, 2111, 2103, 19157, 12491, 5043, 1043, 2078, 12535, 20136, 16921, 4112, 5849, 8191, 14129, 3923, 12092, 102]",2020-08-12,"[""[('last night'"", "" 'TIME')"", "" ('GN Shivamurthy'"", "" 'ORG')"", "" ('Bengaluru'"", "" 'NORP')"", "" ('Karnataka'"", "" 'PERSON')]"", 'shivamurthy deputy', 'place last', 'caused public', 'damage caused', 'city provoked', 'urban karnataka', '#karnataka', 'property appeal', 'disturbed incident', 'appeal people', 'commissioner bengaluru', 'last night', 'deputy commissioner', 'the', 'people city', 'took place', 'night unfortunate', 'incident took', 'unfortunate lot', 'public property']",general,0.1,0.263,0,0.9111635220125787,0.1,0,1,normal_activity,,no_spike,none,0,0.6207403563259014,0,1,0,10,0.19607843137254902
1293428997406285825,ANI,1293428997406285825,1293428997406285825,ANI,2020-08-12 06:07:58,"The incident that took place last night is very unfortunate. A lot of damage has been caused to public property. I appeal to all the people of the city not to be provoked or disturbed by this incident: GN Shivamurthy, Deputy Commissioner, Bengaluru Urban. #Karnataka",184,17,14,incident took place night unfortunate lot damage caused public property appeal people city provoked disturbed incident gn shivamurthy deputy commissioner bengaluru urban karnataka,"shivamurthy deputy, place last, caused public, 'NORP'), 'TIME'), city provoked, damage caused, urban karnataka, 'ORG'), ('Bengaluru', #karnataka, property appeal, disturbed incident, appeal people, 'PERSON')], commissioner bengaluru, last night, deputy commissioner, the, people city, took place, night unfortunate, incident took, unfortunate lot, public property, [('last night', ('GN Shivamurthy', ('Karnataka'",-0.1625,"[101, 5043, 2165, 2173, 2305, 15140, 2843, 4053, 3303, 2270, 3200, 5574, 2111, 2103, 19157, 12491, 5043, 1043, 2078, 12535, 20136, 16921, 4112, 5849, 8191, 14129, 3923, 12092, 102]",2020-08-12,"[""[('last night'"", "" 'TIME')"", "" ('GN Shivamurthy'"", "" 'ORG')"", "" ('Bengaluru'"", "" 'NORP')"", "" ('Karnataka'"", "" 'PERSON')]"", 'shivamurthy deputy', 'place last', 'caused public', 'damage caused', 'city provoked', 'urban karnataka', '#karnataka', 'property appeal', 'disturbed incident', 'appeal people', 'commissioner bengaluru', 'last night', 'deputy commissioner', 'the', 'people city', 'took place', 'night unfortunate', 'incident took', 'unfortunate lot', 'public property']",general,0.1,0.263,0,0.9111635220125787,0.1,0,1,normal_activity,,no_spike,none,1,0.6207403563259014,0,1,0,10,0.19607843137254902
1293429515343953921,Nayan_M_,1293428997406285825,1293428997406285825,ANI,2020-08-12 06:10:01,Appeals? Confiscate properties of Jihadi dogs who did this destruction and make them repay. You can't handle these violent people with soft approach.,1,1,0,appeals confiscate properties jihadi dogs did destruction make repay handle violent people soft approach,"jihadi dogs, soft approach, appeals, people soft, 'PERSON')], make repay, confiscate properties, you, confiscate, destruction make, handle violent, repay handle, violent people, properties jihadi, jihadi, [('Jihadi', appeals confiscate, dogs destruction",-0.35,"[101, 9023, 9530, 8873, 15782, 2618, 5144, 24815, 2072, 6077, 2106, 6215, 2191, 24565, 5047, 6355, 2111, 3730, 3921, 102]",2020-08-12,"[""[('Jihadi'"", "" 'PERSON')]"", 'dogs destruction', 'jihadi dogs', 'soft approach', 'appeals', 'people soft', 'make repay', 'confiscate properties', 'you', 'confiscate', 'destruction make', 'handle violent', 'repay handle', 'violent people', 'jihadi', 'appeals confiscate', 'properties jihadi']",general,0.4,0.004,0,0.7547169811320755,0.4,2,2,normal_activity,,no_spike,none,1,0.0016509626353338283,0,0,0,10,0.19607843137254902
1293429737587503106,KannanSrikumar,1293428997406285825,1293428997406285825,ANI,2020-08-12 06:10:54,"Why soft approach? Take hard stand, make the rioters to compensate loss of public property.",1,1,0,soft approach hard stand make rioters compensate loss public property,"take hard, soft approach, loss public, take, make rioters, riot, approach take, hard stand, why, compensate loss, public property, rioters compensate, stand make, []",-0.0638888888888889,"[101, 3730, 3921, 2524, 3233, 2191, 11421, 2545, 19079, 3279, 2270, 3200, 102]",2020-08-12,"['[]', 'take hard', 'soft approach', 'loss public', 'take', 'make rioters', 'riot', 'approach take', 'hard stand', 'why', 'compensate loss', 'public property', 'rioters compensate', 'stand make']",protest,0.0,0.004,0,0.7547169811320755,0.0,0,2,normal_activity,,no_spike,none,1,0.0016509626353338283,0,0,0,10,0.19607843137254902
1293430346852098048,Kumarshivam1258,1293428997406285825,1293428997406285825,ANI,2020-08-12 06:13:20,Apply yogi model of recovery. Next time they will not do such unlawful drama. ,1,0,0,apply yogi model recovery time unlawful drama,"time unlawful, apply yogi, model recovery, next, next time, apply, yogi model, unlawful drama, recovery next, []",0.0,"[101, 6611, 10930, 5856, 2944, 7233, 2051, 22300, 3689, 102]",2020-08-12,"['[]', 'unlawful drama', 'apply yogi', 'model recovery', 'time unlawful', 'next time', 'apply', 'yogi model', 'next', 'recovery next']",general,0.0,0.001,0,0.5786163522012578,0.0,0,2,normal_activity,,no_spike,none,1,0.00042370229912301496,0,0,0,10,0.19607843137254902
1293429508205248512,TheCogentGuy,1293428997406285825,1293428997406285825,ANI,2020-08-12 06:10:00,Must take action against peaceful religion,1,0,0,action peaceful religion,"peaceful, must take, must, action peaceful, take action, peaceful religion, []",0.175,"[101, 2895, 9379, 4676, 102]",2020-08-12,"['[]', 'peaceful', 'must take', 'must', 'action peaceful', 'take action', 'peaceful religion']",protest,0.0,0.001,0,0.5786163522012578,0.0,0,2,normal_activity,,no_spike,none,1,0.00042370229912301496,0,0,0,10,0.19607843137254902
1293443641784930304,Harshpa54532847,1293428997406285825,1293428997406285825,ANI,2020-08-12 07:06:09,"x.com/Harshpa5453284
…",0,0,0,xcomharshpa5453284,[],0.0,"[101, 1060, 9006, 8167, 4095, 4502, 27009, 22275, 22407, 2549, 102]",2020-08-12,['[]'],general,0.0,0.0,0,0.2562893081761006,0.0,0,2,normal_activity,,no_spike,none,1,0.0,0,0,0,10,0.19607843137254902
1293437797760528384,AKSriva24243482,1293428997406285825,1293428997406285825,ANI,2020-08-12 06:42:56,"Bangalore and Delhi riots are the work of antinationals and Islamic terrorists.

Indi will not grow unless and until they are finished.
@narendramodi
 
@AmitShah",0,0,0,bangalore delhi riots work antinationals islamic terrorists indi grow unless finished narendramodi amitshah,"islamic terrorists, ('Delhi', islamic, [('Bangalore', finished narendramodi, 'NORP'), narendramodi amitshah, 'GPE'), amitshah, riots work, unless finished, 'PERSON')], riot, delhi, antinationals islamic, ('Indi', grow unless, terrorist, bangalore delhi, indi, work antinationals, terrorists indi, ('Islamic', bangalore, 'PERSON'), delhi riots, @narendramodi, indi grow",0.0,"[101, 14022, 6768, 12925, 2147, 3424, 25434, 2015, 5499, 15554, 27427, 2072, 4982, 4983, 2736, 6583, 7389, 7265, 5302, 4305, 26445, 3215, 3270, 2232, 102]",2020-08-12,"[""[('Bangalore'"", "" 'PERSON')"", "" ('Delhi'"", "" 'GPE')"", "" ('Islamic'"", "" 'NORP')"", "" ('Indi'"", "" 'PERSON')]"", 'islamic terrorists', 'islamic', 'finished narendramodi', 'narendramodi amitshah', 'amitshah', 'riots work', 'unless finished', 'riot', 'delhi', 'antinationals islamic', 'grow unless', 'terrorist', 'bangalore delhi', 'indi', 'work antinationals', 'terrorists indi', 'bangalore', 'delhi riots', '@narendramodi', 'indi grow']",protest,0.6000000000000001,0.0,0,0.2562893081761006,0.6000000000000001,3,2,normal_activity,,no_spike,none,1,0.0,2,0,0,10,0.19607843137254902
1293462732688125953,Coronavirus010,1293428997406285825,1293428997406285825,ANI,2020-08-12 08:22:01,Tax payers public property burn,0,0,0,tax payers public property burn,"payers public, public property, property burn, tax, tax payers, []",0.0,"[101, 4171, 3477, 2545, 2270, 3200, 6402, 102]",2020-08-12,"['[]', 'payers public', 'public property', 'property burn', 'tax', 'tax payers']",general,0.2,0.0,0,0.2562893081761006,0.2,1,2,normal_activity,,no_spike,none,1,0.0003711068973690448,0,0,0,10,0.19607843137254902
1293435377781366785,davinder249907,1293428997406285825,1293428997406285825,ANI,2020-08-12 06:33:19,Recover damages from culprits as of Yogi govt.,0,0,0,recover damages culprits yogi govt,"[('Yogi', culprits yogi, damages culprits, yogi govt, 'PERSON')], yogi, recover, recover damages",0.0,"[101, 8980, 12394, 12731, 14277, 14778, 2015, 10930, 5856, 22410, 102]",2020-08-12,"[""[('Yogi'"", "" 'PERSON')]"", 'culprits yogi', 'damages culprits', 'yogi govt', 'yogi', 'recover', 'recover damages']",general,0.0,0.0,0,0.2562893081761006,0.0,0,2,normal_activity,,no_spike,none,1,0.0,0,0,0,10,0.19607843137254902
1294163311899090944,ANI,1294163311899090944,0,,2020-08-14 06:45:52,"Karnataka: Personnel of Rapid Action Force (RAF) and local police conduct flag-march in the JC Nagar area of Bengaluru, following August 11 violence.",450,31,8,karnataka personnel rapid action force raf local police conduct flagmarch jc nagar area bengaluru following august 11 violence,"march, nagar, personnel rapid, [('Karnataka', nagar area, 'DATE')], 'GPE'), 'ORG'), ('Bengaluru', bengaluru, ('August 11', police, august, bengaluru following, jc nagar, rapid action force, rapid action, force raf, police conduct, local police, karnataka, august violence, raf local, personnel, area bengaluru, conduct nagar, 'PERSON'), ('RAF'",0.0333333333333333,"[101, 12092, 5073, 5915, 2895, 2486, 7148, 2334, 2610, 6204, 5210, 7849, 2818, 29175, 16395, 2181, 8191, 14129, 2206, 2257, 2340, 4808, 102]",2020-08-14,"[""[('Karnataka'"", "" 'PERSON')"", "" ('RAF'"", "" 'ORG')"", "" ('Bengaluru'"", "" 'GPE')"", "" ('August 11'"", "" 'DATE')]"", 'march', 'nagar', 'personnel rapid', 'nagar area', 'bengaluru', 'police', 'august', 'bengaluru following', 'jc nagar', 'rapid action force', 'rapid action', 'force raf', 'police conduct', 'local police', 'karnataka', 'august violence', 'raf local', 'personnel', 'area bengaluru', 'conduct nagar']",protest,0.2,0.559,0,0.9339622641509434,0.2,1,0,normal_activity,,no_spike,none,0,0.6207403563259014,0,0,0,1,0.0196078431372549
1293604641356226562,AbrabWorld,1293604641356226562,0,,2020-08-12 17:45:55,"ABRAB WORLD: 2020 Bangalore riots 
abrabworld515.blogspot.com/2020/08/2020-b
…",0,0,0,abrab world 2020 bangalore riots abrabworld515blogspotcom2020082020b,"'CARDINAL'), ('2020', bangalore, bangalore riots, 'PERSON')], world bangalore, abrab, riot, ('Bangalore', abrab world, [('ABRAB', 'ORG')",0.0,"[101, 11113, 2527, 2497, 2088, 12609, 14022, 12925, 11113, 2527, 2497, 11108, 22203, 2629, 16558, 8649, 13102, 4140, 9006, 11387, 28332, 2620, 11387, 11387, 2497, 102]",2020-08-12,"[""[('ABRAB'"", "" 'ORG')"", "" ('2020'"", "" 'CARDINAL')"", "" ('Bangalore'"", "" 'PERSON')]"", 'bangalore', 'bangalore riots', 'world bangalore', 'abrab', 'riot', 'abrab world']",protest,0.2,0.0,0,0.2562893081761006,0.2,1,0,normal_activity,,no_spike,none,0,0.0,0,0,0,1,0.0196078431372549
1293591189405327360,helodoyouknowme,1293591189405327360,0,,2020-08-12 16:52:27,"Hello 
@Wikipedia
 ,
Your Article on Bangalore Riots has missing some information. Riots Background started from here:
Bangalore Riots 2020.
He insulted Hindu Gods. Please make it correct in your article.",0,0,0,hello wikipedia article bangalore riots missing information riots background started bangalore riots 2020 insulted hindu gods make correct article,"missing information, ('Hindu', gods please, information riots, make correct, wikipedia article, started bangalore, [('@Wikipedia\n ', bangalore riots, 'DATE'), insulted hindu, riot, 'WORK_OF_ART'), correct article, riots missing, ('Riots Background', article bangalore, ('2020', riots background, wikipedia, hello wikipedia, please make, hello, @wikipedia, ('Bangalore Riots', hindu gods, your article, 'PERSON'), 'NORP')]",-0.2,"[101, 7592, 16948, 3720, 14022, 12925, 4394, 2592, 12925, 4281, 2318, 14022, 12925, 12609, 23637, 7560, 5932, 2191, 6149, 3720, 102]",2020-08-12,"[""[('@Wikipedia\\n '"", "" 'PERSON')"", "" ('Riots Background'"", "" 'PERSON')"", "" ('Bangalore Riots'"", "" 'WORK_OF_ART')"", "" ('2020'"", "" 'DATE')"", "" ('Hindu'"", "" 'NORP')]"", 'missing information', 'gods please', 'information riots', 'make correct', 'wikipedia article', 'started bangalore', 'bangalore riots', 'insulted hindu', 'riot', 'correct article', 'riots missing', 'article bangalore', 'riots background', 'wikipedia', 'hello wikipedia', 'please make', 'hello', '@wikipedia', 'hindu gods', 'your article']",protest,0.6000000000000001,0.0,0,0.2562893081761006,0.6000000000000001,3,0,normal_activity,,no_spike,none,0,0.0,1,0,0,1,0.0196078431372549
