id,speaker_nm,conversation_id,reply_to_id,reply_to_nm,timestamp,text,likes,shares,num_comments,cleaned_text,named_entities,sentiment,tokens,date,extracted_entities,content_category,enhanced_hate_score,virality_score,spike_day,engagement_rank,hate_intensity,hate_keywords_count,reply_chain_depth,spike_cause,spike_top_entities,spike_external_cause,contextual_relevance,is_reply,user_influence,mention_count,hashtag_count,url_count,conversation_size,conversation_centrality
1346406263689801733,tammycbaggett,1346052521052270594,1346052521052270594,cnni,2021-01-05 10:40:42,CNN China New Network.,0,0,0,cnn china new network,"('China', china, cnn china, china new network, cnn, china new, 'ORG'), 'GPE')], [('CNN', network, new network",0.1363636363636363,"[101, 13229, 2859, 2047, 2897, 102]",2021-01-05,"[""[('CNN'"", "" 'ORG')"", "" ('China'"", "" 'GPE')]"", 'china', 'cnn china', 'china new network', 'cnn', 'china new', 'network', 'new network']",international,0.0,0.0,1,0.12428977272727272,0.0,0,1,activity_spike,"[](7), 'ORG')](4), 'PERSON')](4), trump(3), china(3)","Guardian correlation: China 'misled world' on Hong Kong security law, says Dominic Raab (score: 3, strength: medium)",general,1,0.0,0,0,0,18,1.0
1346147405687902210,AndrewFeinberg,1346147405687902210,0,,2021-01-04 17:32:06,Worth noting that the Capitol Hill streets she is walking down are blocked off to traffic and guarded by Capitol Police checkpoints.,85,13,16,worth noting capitol hill streets walking blocked traffic guarded capitol police checkpoints,"walking blocked, ('Capitol Police', traffic guarded, hill streets, capitol police, guarded capitol, noting capitol, 'ORG'), police checkpoints, capitol hill, [('Capitol Hill', worth, streets walking, worth noting, capitol, blocked traffic, 'ORG')], police",0.1814814814814815,"[101, 4276, 9073, 9424, 2940, 4534, 3788, 8534, 4026, 13802, 9424, 2610, 26520, 2015, 102]",2021-01-04,"[""[('Capitol Hill'"", "" 'ORG')"", "" ('Capitol Police'"", "" 'ORG')]"", 'walking blocked', 'traffic guarded', 'hill streets', 'capitol police', 'noting capitol', 'police checkpoints', 'capitol hill', 'worth noting', 'worth', 'streets walking', 'capitol', 'blocked traffic', 'police', 'guarded capitol']",protest,0.0,0.156,1,0.8920454545454546,0.0,0,0,volume_spike_viral_content,"'ORG')(103), [](101), 'ORG')](87), 'PERSON')(60), trump(54)",Nothing significant - no contextually relevant news found for general spike,no_correlation,0,0.03337288501787617,0,0,0,11,0.6111111111111112
1346149154054053889,Rawwwb1,1346147405687902210,1346147405687902210,AndrewFeinberg,2021-01-04 17:39:03,"I'm trying to picture how silly it would look if Boris Johnson campaigned saying ""I will wear a gun into Parliament""",3,0,0,im trying picture silly look boris johnson campaigned saying wear gun parliament,"('Parliament', saying wear, campaigned saying, silly would, johnson campaigned, parliament, boris johnson, would look, trying picture, picture silly, gun parliament, look boris, 'PERSON'), wear gun, [('Boris Johnson', 'ORG')]",-0.5,"[101, 10047, 2667, 3861, 10021, 2298, 11235, 3779, 16196, 3038, 4929, 3282, 3323, 102]",2021-01-04,"[""[('Boris Johnson'"", "" 'PERSON')"", "" ('Parliament'"", "" 'ORG')]"", 'saying wear', 'gun parliament', 'look boris', 'johnson campaigned', 'parliament', 'boris johnson', 'wear gun', 'trying picture', 'picture silly', 'silly would', 'would look', 'campaigned saying']",general,0.0,0.003,1,0.5035511363636364,0.0,0,1,volume_spike_viral_content,"'ORG')(103), [](101), 'ORG')](87), 'PERSON')(60), trump(54)",Nothing significant - no contextually relevant news found for general spike,no_correlation,1,0.0012152537202128743,0,0,0,11,0.6111111111111112
1346150446616834048,jamesconsidin16,1346147405687902210,1346147405687902210,AndrewFeinberg,2021-01-04 17:44:11,"So it’s like a charade, wonder where she picked that up from?",3,0,0,like charade wonder picked,"wonder picked, charade wonder, [], like charade",0.0,"[101, 2066, 25869, 9648, 4687, 3856, 102]",2021-01-04,"['[]', 'wonder picked', 'charade wonder', 'like charade']",general,0.0,0.003,1,0.5035511363636364,0.0,0,1,volume_spike_viral_content,"'ORG')(103), [](101), 'ORG')](87), 'PERSON')(60), trump(54)",Nothing significant - no contextually relevant news found for general spike,no_correlation,1,0.0012152537202128743,0,0,0,11,0.6111111111111112
1346148089715978247,KnockoC,1346147405687902210,1346147405687902210,AndrewFeinberg,2021-01-04 17:34:49,She seems really smart,2,0,0,really smart,"she, [], seems really, really smart",0.2142857142857142,"[101, 2428, 6047, 102]",2021-01-04,"['[]', 'really smart', 'seems really', 'she']",general,0.1,0.002,1,0.4169034090909091,0.1,0,1,volume_spike_viral_content,"'ORG')(103), [](101), 'ORG')](87), 'PERSON')(60), trump(54)",Nothing significant - no contextually relevant news found for general spike,no_correlation,1,0.0008101691468085828,0,0,0,11,0.6111111111111112
1346149697510137856,Mark_this,1346147405687902210,1346147405687902210,AndrewFeinberg,2021-01-04 17:41:12,"In the spirit of the late, great Michael O'Donohue, I hope she's run over by a mammoth truck.",1,0,0,spirit late great michael odonohue hope shes run mammoth truck,"run mammoth, late great, donohue, hope run, mammoth truck, great michael, michael, michael hope, michael o'donohue, [(""Michael O'Donohue"", 'PERSON')], spirit late",0.25,"[101, 4382, 2397, 2307, 2745, 1051, 5280, 11631, 5657, 3246, 2016, 2015, 2448, 23714, 4744, 102]",2021-01-04,"['[(""Michael O\'Donohue""', "" 'PERSON')]"", 'run mammoth', 'late great', 'donohue', 'hope run', 'mammoth truck', 'great michael', 'michael', 'michael hope', ""michael o'donohue"", 'spirit late']",general,0.0,0.001,1,0.30610795454545453,0.0,0,1,volume_spike_viral_content,"'ORG')(103), [](101), 'ORG')](87), 'PERSON')(60), trump(54)",Nothing significant - no contextually relevant news found for general spike,no_correlation,1,0.0004050845734042914,0,0,0,11,0.6111111111111112
1346151260106481668,SarahBigelow5,1346147405687902210,1346147405687902210,AndrewFeinberg,2021-01-04 17:47:25,Wow.  She's really...something.  Geezus.,1,0,0,wow shes reallysomething geezus,"something geezus, [], she, geezus, wow really, really something, wow",0.1,"[101, 10166, 2016, 2015, 2428, 14045, 20744, 20277, 9759, 2015, 102]",2021-01-04,"['[]', 'something geezus', 'she', 'geezus', 'wow really', 'really something', 'wow']",general,0.1,0.001,1,0.30610795454545453,0.1,0,1,volume_spike_viral_content,"'ORG')(103), [](101), 'ORG')](87), 'PERSON')(60), trump(54)",Nothing significant - no contextually relevant news found for general spike,no_correlation,1,0.0004050845734042914,0,0,0,11,0.6111111111111112
1346165424115875842,Quintus74689745,1346147405687902210,1346147405687902210,AndrewFeinberg,2021-01-04 18:43:42,"Guns are idols, for a large number of Americans",1,0,0,guns idols large number americans,"guns, guns idols, large number, idols large, 'NORP')], number americans, [('Americans', americans",0.2142857142857142,"[101, 4409, 24438, 2312, 2193, 4841, 102]",2021-01-04,"[""[('Americans'"", "" 'NORP')]"", 'guns', 'guns idols', 'large number', 'idols large', 'number americans', 'americans']",general,0.0,0.001,1,0.30610795454545453,0.0,0,1,volume_spike_viral_content,"'ORG')(103), [](101), 'ORG')](87), 'PERSON')(60), trump(54)",Nothing significant - no contextually relevant news found for general spike,no_correlation,1,0.0004050845734042914,0,0,0,11,0.6111111111111112
1346156824337248256,rjb926,1346147405687902210,1346147405687902210,AndrewFeinberg,2021-01-04 18:09:31,If she’s dumb enough not to have that locked while wearing heels...,0,0,0,shes dumb locked wearing heels,"[], locked wearing, wearing heels, enough locked, dumb enough",-0.1875,"[101, 2016, 2015, 12873, 5299, 4147, 8265, 102]",2021-01-04,"['[]', 'enough locked', 'locked wearing', 'dumb enough', 'wearing heels']",general,0.2,0.0,1,0.12428977272727272,0.2,1,1,volume_spike_viral_content,"'ORG')(103), [](101), 'ORG')](87), 'PERSON')(60), trump(54)",Nothing significant - no contextually relevant news found for general spike,no_correlation,1,0.0,0,0,0,11,0.6111111111111112
1346165840484462602,Kline,1346147405687902210,1346147405687902210,AndrewFeinberg,2021-01-04 18:45:21,Mr. Irving is not going to be pleased.,0,0,0,mr irving going pleased,"irving, mr., irving going, [('Irving', 'PERSON')], going pleased",0.5,"[101, 2720, 12415, 2183, 7537, 102]",2021-01-04,"[""[('Irving'"", "" 'PERSON')]"", 'mr.', 'irving going', 'irving', 'going pleased']",general,0.0,0.0,1,0.12428977272727272,0.0,0,1,volume_spike_viral_content,"'ORG')(103), [](101), 'ORG')](87), 'PERSON')(60), trump(54)",Nothing significant - no contextually relevant news found for general spike,no_correlation,1,0.0,0,0,0,11,0.6111111111111112
1346167598682136579,RalphCiinema,1346147405687902210,1346147405687902210,AndrewFeinberg,2021-01-04 18:52:20,Gun-crazy Americans *shaking head in disbelief*,0,0,0,guncrazy americans shaking head disbelief,"gun, 'NORP')], head disbelief, shaking head, americans shaking, [('Americans', americans",0.0,"[101, 3282, 26775, 10936, 2100, 4841, 5513, 2132, 12537, 102]",2021-01-04,"[""[('Americans'"", "" 'NORP')]"", 'head disbelief', 'shaking head', 'americans shaking', 'gun', 'americans']",general,0.0,0.0,1,0.12428977272727272,0.0,0,1,volume_spike_viral_content,"'ORG')(103), [](101), 'ORG')](87), 'PERSON')(60), trump(54)",Nothing significant - no contextually relevant news found for general spike,no_correlation,1,0.0,0,0,0,11,0.6111111111111112
1346169120375660545,vgabriele216,1346147405687902210,1346147405687902210,AndrewFeinberg,2021-01-04 18:58:23,It’s also worth noting she’s an ass,0,0,0,worth noting shes ass,"noting ass, [], also worth, worth noting",0.3,"[101, 4276, 9073, 2016, 2015, 4632, 102]",2021-01-04,"['[]', 'noting ass', 'also worth', 'worth noting']",general,0.0,0.0,1,0.12428977272727272,0.0,0,1,volume_spike_viral_content,"'ORG')(103), [](101), 'ORG')](87), 'PERSON')(60), trump(54)",Nothing significant - no contextually relevant news found for general spike,no_correlation,1,0.0,0,0,0,11,0.6111111111111112
1346156058725806081,carlquintanilla,1346156058725806081,0,,2021-01-04 18:06:29,"WASHINGTON (AP) — Washington, D.C.‘s mayor urged calm Monday as some 340 National Guard troops were being activated while the city prepared for potentially violent protests surrounding Congress’ expected vote to affirm President-elect Joe Biden’s victory. https://apnews.com/article/joe-biden-donald-trump-politics-electoral-college-muriel-bowser-1634bf71a27de48efef3cd1e6ed4abe4…",194,104,30,washington ap washington dcs mayor urged calm monday 340 national guard troops activated city prepared potentially violent protests surrounding congress expected vote affirm presidentelect joe bidens victory,"('AP', ('Joe Biden’s', washington mayor, mayor urged, d.c., joe biden, monday, victory https, vote affirm, potentially violent, guard troops, urged calm, [('WASHINGTON', prepared potentially, monday national, congress expected, protests surrounding, washington washington, city prepared, biden, 'ORG'), ('Washington', calm monday, 'PERSON')], washington, troops activated, ('Congress', ('National Guard', ('Monday', 'GPE'), 'DATE')",-0.1999999999999999,"[101, 2899, 9706, 2899, 5887, 2015, 3664, 9720, 5475, 6928, 16029, 2120, 3457, 3629, 8878, 2103, 4810, 9280, 6355, 8090, 4193, 3519, 3517, 3789, 21358, 27972, 2343, 12260, 6593, 3533, 7226, 6132, 3377, 102]",2021-01-04,"[""[('WASHINGTON'"", "" 'GPE')"", "" ('AP'"", "" 'ORG')"", "" ('Washington'"", "" 'GPE')"", "" ('Monday'"", "" 'DATE')"", "" ('National Guard'"", "" 'ORG')"", "" ('Congress'"", "" 'ORG')"", "" ('Joe Biden’s'"", "" 'PERSON')]"", 'washington mayor', 'mayor urged', 'd.c.', 'joe biden', 'monday', 'victory https', 'vote affirm', 'potentially violent', 'guard troops', 'urged calm', 'prepared potentially', 'monday national', 'congress expected', 'protests surrounding', 'washington washington', 'city prepared', 'biden', 'calm monday', 'washington', 'troops activated']",politics,0.1,0.566,1,0.9517045454545454,0.1,0,0,volume_spike_viral_content,"'ORG')(103), [](101), 'ORG')](87), 'PERSON')(60), trump(54)",Nothing significant - no contextually relevant news found for general spike,no_correlation,0,0.23542962452734728,0,0,1,11,0.6111111111111112
1346156858474696704,thehowie,1346156058725806081,1346156058725806081,carlquintanilla,2021-01-04 18:09:40,The President of the United States is inciting violence and making claims to a naive base that a massive electoral fraud has occurred.  What could go wrong?,12,3,1,president united states inciting violence making claims naive base massive electoral fraud occurred wrong,"states inciting, violence making, making claims, the president, fraud occurred, occurred could, inciting violence, what, naive base, massive electoral, 'GPE')], base massive, president, violence, could wrong, [('the United States', claims naive, united states, electoral fraud, president united",-0.4,"[101, 2343, 2142, 2163, 4297, 15402, 4808, 2437, 4447, 15743, 2918, 5294, 6092, 9861, 4158, 3308, 102]",2021-01-04,"[""[('the United States'"", "" 'GPE')]"", 'fraud occurred', 'violence', 'president', 'occurred could', 'could wrong', 'inciting violence', 'states inciting', 'massive electoral', 'violence making', 'united states', 'base massive', 'the president', 'making claims', 'claims naive', 'what', 'electoral fraud', 'naive base', 'president united']",politics,0.4,0.023,1,0.7911931818181818,0.4,2,1,volume_spike_viral_content,"'ORG')(103), [](101), 'ORG')](87), 'PERSON')(60), trump(54)",Nothing significant - no contextually relevant news found for general spike,no_correlation,1,0.009501110919266862,0,0,0,11,0.6111111111111112
1346156682137755650,NatureConnie,1346156058725806081,1346156058725806081,carlquintanilla,2021-01-04 18:08:58,"Thank God someone has some brains in Washington and, yes, it’s a woman!",8,0,0,thank god brains washington yes woman,"brains washington, thank, someone brains, god someone, 'GPE')], thank god, washington yes, [('Washington', washington, yes woman",0.0,"[101, 4067, 2643, 14332, 2899, 2748, 2450, 102]",2021-01-04,"[""[('Washington'"", "" 'GPE')]"", 'brains washington', 'thank', 'someone brains', 'god someone', 'thank god', 'washington yes', 'washington', 'yes woman']",general,0.05,0.008,1,0.65625,0.05,0,1,volume_spike_viral_content,"'ORG')(103), [](101), 'ORG')](87), 'PERSON')(60), trump(54)",Nothing significant - no contextually relevant news found for general spike,no_correlation,1,0.003240676587234331,0,0,0,11,0.6111111111111112
1346157754738610176,twidark1,1346156058725806081,1346156058725806081,carlquintanilla,2021-01-04 18:13:13,I am assuming DHS goons with military camo gear without LOE badges and their unmarked vans will be missing in action on Jan 6.,6,0,1,assuming dhs goons military camo gear loe badges unmarked vans missing action jan 6,"military camo, [('DHS', gear without, dhs, jan, vans missing, missing action, loe badges, 'ORG'), action jan, goons military, dhs goons, unmarked vans, assuming dhs, badges unmarked, ('LOE', 'DATE')], military, camo gear, without loe, ('Jan 6', loe",-0.0666666666666666,"[101, 10262, 28144, 2015, 27571, 3619, 2510, 11503, 2080, 6718, 8840, 2063, 23433, 25779, 21994, 4394, 2895, 5553, 1020, 102]",2021-01-04,"[""[('DHS'"", "" 'ORG')"", "" ('LOE'"", "" 'ORG')"", "" ('Jan 6'"", "" 'DATE')]"", 'unmarked vans', 'military camo', 'gear without', 'missing action', 'assuming dhs', 'loe badges', 'badges unmarked', 'action jan', 'goons military', 'military', 'dhs', 'dhs goons', 'jan', 'camo gear', 'vans missing', 'without loe', 'loe']",international,0.0,0.008,1,0.65625,0.0,0,1,volume_spike_viral_content,"'ORG')(103), [](101), 'ORG')](87), 'PERSON')(60), trump(54)",Nothing significant - no contextually relevant news found for general spike,no_correlation,1,0.00329053145002959,0,0,0,11,0.6111111111111112
1346156835645087746,mskeviar,1346156058725806081,1346156058725806081,carlquintanilla,2021-01-04 18:09:34,Like a boss!! Better to be proactive then reactive! Protect my city!! #ProtectDemocracy,4,0,0,like boss better proactive reactive protect city protectdemocracy,"like, better proactive, proactive reactive, city protectdemocracy, protect, protect city, boss better, like boss, [('ProtectDemocracy', 'PERSON')], better, reactive protect, #protectdemocracy",0.9765625,"[101, 2066, 5795, 2488, 4013, 19620, 22643, 4047, 2103, 4047, 3207, 5302, 26775, 15719, 102]",2021-01-04,"[""[('ProtectDemocracy'"", "" 'PERSON')]"", 'like', 'better proactive', 'proactive reactive', 'city protectdemocracy', 'protect', 'protect city', 'boss better', 'like boss', 'reactive protect', 'better', '#protectdemocracy']",general,0.15,0.004,1,0.5568181818181818,0.15,0,1,volume_spike_viral_content,"'ORG')(103), [](101), 'ORG')](87), 'PERSON')(60), trump(54)",Nothing significant - no contextually relevant news found for general spike,no_correlation,1,0.0016203382936171656,0,1,0,11,0.6111111111111112
1346156780510965763,GuyFawk86006293,1346156058725806081,1346156058725806081,carlquintanilla,2021-01-04 18:09:21,"Oh, where are the cries of ""thugs"" and ""anarchists""? Why is the right so quiet in the face of White Supremacists and Conservative extremists stalking the streets of DC with the intent to cause harm? 
@TuckerCarlson
 @benshapiro
 @FoxNews",2,0,0,oh cries thugs anarchists right quiet face white supremacists conservative extremists stalking streets dc intent cause harm tuckercarlson benshapiro foxnews,"@foxnews, conservative, benshapiro foxnews, anarchists right, intent cause, tuckercarlson, streets intent, @benshapiro, stalking streets, white supremacists, quiet face, 'ORG'), face white, harm tuckercarlson, 'PERSON')], why, conservative extremists, tuckercarlson benshapiro, cause harm, cries thugs, @tuckercarlson, extremist, [('White Supremacists', ('@TuckerCarlson\n @benshapiro\n @FoxNews', ('DC', 'GPE')",0.0952380952380952,"[101, 2821, 12842, 24106, 18448, 2015, 2157, 4251, 2227, 2317, 10514, 28139, 22911, 5130, 4603, 4654, 7913, 23738, 2015, 20070, 4534, 5887, 7848, 3426, 7386, 9802, 10010, 14881, 3841, 7377, 8197, 3217, 4419, 2638, 9333, 102]",2021-01-04,"[""[('White Supremacists'"", "" 'ORG')"", "" ('DC'"", "" 'GPE')"", "" ('@TuckerCarlson\\n @benshapiro\\n @FoxNews'"", "" 'PERSON')]"", '@foxnews', 'conservative', 'benshapiro foxnews', 'anarchists right', 'intent cause', 'tuckercarlson', 'streets intent', '@benshapiro', 'stalking streets', 'white supremacists', 'quiet face', 'face white', 'harm tuckercarlson', 'why', 'conservative extremists', 'tuckercarlson benshapiro', 'cause harm', 'cries thugs', '@tuckercarlson', 'extremist']",terrorism,0.4,0.002,1,0.4169034090909091,0.4,2,1,volume_spike_viral_content,"'ORG')(103), [](101), 'ORG')](87), 'PERSON')(60), trump(54)",Nothing significant - no contextually relevant news found for general spike,no_correlation,1,0.0008101691468085828,3,0,0,11,0.6111111111111112
1346170424078585857,CarterG46842078,1346156058725806081,1346156058725806081,carlquintanilla,2021-01-04 19:03:34,"The plan doesn't work if we STAY HOME!
 We won! Let them fight among themselves.",2,0,0,plan doesnt work stay home won let fight,"plan work, the, [], let fight, let, work stay, stay home, fight among, home let",0.0,"[101, 2933, 2987, 2102, 2147, 2994, 2188, 2180, 2292, 2954, 102]",2021-01-04,"['[]', 'plan work', 'the', 'let fight', 'let', 'work stay', 'stay home', 'fight among', 'home let']",general,0.30000000000000004,0.002,1,0.4169034090909091,0.30000000000000004,1,1,volume_spike_viral_content,"'ORG')(103), [](101), 'ORG')](87), 'PERSON')(60), trump(54)",Nothing significant - no contextually relevant news found for general spike,no_correlation,1,0.0008101691468085828,0,0,0,11,0.6111111111111112
1346157130399805443,Timeismc2,1346156058725806081,1346156058725806081,carlquintanilla,2021-01-04 18:10:44,Putin's plan is beginning to come to fruition.,1,0,1,putins plan beginning come fruition,"plan beginning, [('Putin', come fruition, putin, putin plan, beginning come, 'PERSON')]",0.0,"[101, 22072, 2015, 2933, 2927, 2272, 5909, 3258, 102]",2021-01-04,"[""[('Putin'"", "" 'PERSON')]"", 'plan beginning', 'come fruition', 'putin', 'putin plan', 'beginning come']",general,0.0,0.003,1,0.5035511363636364,0.0,0,1,volume_spike_viral_content,"'ORG')(103), [](101), 'ORG')](87), 'PERSON')(60), trump(54)",Nothing significant - no contextually relevant news found for general spike,no_correlation,1,0.001265108583008133,0,0,0,11,0.6111111111111112
1346169569887596544,LittleLee561,1346156058725806081,1346156058725806081,carlquintanilla,2021-01-04 19:00:10,Trump has a fit about groups like BLM protecting but has no problem over rightwing protesters.,1,0,0,trump fit groups like blm protecting problem rightwing protesters,"protecting problem, groups like, 'ORG'), [('Trump', trump fit, blm, fit groups, problem rightwing, ('BLM', trump, protest, rightwing protesters, like blm, 'ORG')], blm protecting",0.4,"[101, 8398, 4906, 2967, 2066, 1038, 13728, 8650, 3291, 2157, 9328, 13337, 102]",2021-01-04,"[""[('Trump'"", "" 'ORG')"", "" ('BLM'"", "" 'ORG')]"", 'protecting problem', 'groups like', 'trump fit', 'blm', 'fit groups', 'problem rightwing', 'trump', 'protest', 'rightwing protesters', 'like blm', 'blm protecting']",social,0.0,0.001,1,0.30610795454545453,0.0,0,1,volume_spike_viral_content,"'ORG')(103), [](101), 'ORG')](87), 'PERSON')(60), trump(54)",Nothing significant - no contextually relevant news found for general spike,no_correlation,1,0.0004050845734042914,0,0,0,11,0.6111111111111112
1346186564284592129,baryonic,1346156058725806081,1346156058725806081,carlquintanilla,2021-01-04 20:07:42,Trump would love an excuse to declare martial law.,1,0,0,trump love excuse declare martial law,"martial law, declare martial, [('Trump', trump, would love, love excuse, 'ORG')], excuse declare, trump would",0.15,"[101, 8398, 2293, 8016, 13520, 7761, 2375, 102]",2021-01-04,"[""[('Trump'"", "" 'ORG')]"", 'martial law', 'declare martial', 'trump', 'would love', 'love excuse', 'excuse declare', 'trump would']",politics,0.0,0.001,1,0.30610795454545453,0.0,0,1,volume_spike_viral_content,"'ORG')(103), [](101), 'ORG')](87), 'PERSON')(60), trump(54)",Nothing significant - no contextually relevant news found for general spike,no_correlation,1,0.0004050845734042914,0,0,0,11,0.6111111111111112
1346157342027632651,alycemichelbri1,1346156058725806081,1346156058725806081,carlquintanilla,2021-01-04 18:11:35,Call for us to stay home - take away their oxygen and have nothing to do but chant.  Flag makers have never been richer!,0,0,0,stay home away oxygen chant flag makers richer,"flag, makers never, away oxygen, [], nothing chant, never richer, flag makers, chant flag, home take, call stay, stay home, take away, call, oxygen nothing",0.0,"[101, 2994, 2188, 2185, 7722, 16883, 5210, 11153, 26108, 102]",2021-01-04,"['[]', 'flag', 'makers never', 'away oxygen', 'nothing chant', 'never richer', 'flag makers', 'oxygen nothing', 'chant flag', 'home take', 'stay home', 'take away', 'call', 'call stay']",general,0.25,0.0,1,0.12428977272727272,0.25,0,1,volume_spike_viral_content,"'ORG')(103), [](101), 'ORG')](87), 'PERSON')(60), trump(54)",Nothing significant - no contextually relevant news found for general spike,no_correlation,1,0.0,0,0,0,11,0.6111111111111112
1346141732149325825,CBSEveningNews,1346141732149325825,0,,2021-01-04 17:09:33,"Pres. Trump is expected to award Rep. Devin Nunes (R-CA) and Rep. Jim Jordan (R-OH), two of his staunchest allies on Capitol Hill, with the Presidential Medal of Freedom. https://cbsn.ws/2L3edOj",51,75,107,pres trump expected award rep devin nunes rca rep jim jordan roh staunchest allies capitol hill presidential medal freedom,"jim jordan, medal freedom, two staunchest, staunchest allies, jordan two, devin nunes, war, ('Devin Nunes', 'CARDINAL'), trump expected, rep, 'ORG'), expected award, ('the Presidential Medal of Freedom', pres, ('Jim Jordan', ('two', presidential medal, trump, president, 'ORG')], allies capitol, freedom https, freedom, [('Trump', award devin, capitol hill, pres trump, ('Capitol Hill', 'PERSON')",-0.1,"[101, 3653, 2015, 8398, 3517, 2400, 16360, 23601, 16634, 2229, 12639, 16360, 3958, 5207, 20996, 2232, 26355, 4355, 6956, 9424, 2940, 4883, 3101, 4071, 102]",2021-01-04,"[""[('Trump'"", "" 'ORG')"", "" ('Devin Nunes'"", "" 'PERSON')"", "" ('Jim Jordan'"", "" 'PERSON')"", "" ('two'"", "" 'CARDINAL')"", "" ('Capitol Hill'"", "" 'ORG')"", "" ('the Presidential Medal of Freedom'"", "" 'ORG')]"", 'jim jordan', 'medal freedom', 'two staunchest', 'staunchest allies', 'jordan two', 'devin nunes', 'war', 'trump expected', 'rep', 'expected award', 'pres', 'trump', 'president', 'allies capitol', 'freedom https', 'freedom', 'award devin', 'capitol hill', 'pres trump', 'presidential medal']",politics,0.30000000000000004,0.49,1,0.9431818181818182,0.30000000000000004,1,0,volume_spike_viral_content,"'ORG')(103), [](101), 'ORG')](87), 'PERSON')(60), trump(54)",Nothing significant - no contextually relevant news found for general spike,no_correlation,0,0.11672430940038128,0,0,1,16,0.8888888888888888
1346177989508169728,RealMarkEbner,1346141732149325825,1346141732149325825,CBSEveningNews,2021-01-04 19:33:38,"Gym gets his door prize, and Nunes had a cow.",2,0,0,gym gets door prize nunes cow,"gym, door prize, nunes cow, 'GPE')], [('Nunes', nunes, gets door, prize nunes, gym gets",-0.1333333333333333,"[101, 9726, 4152, 2341, 3396, 16634, 2229, 11190, 102]",2021-01-04,"[""[('Nunes'"", "" 'GPE')]"", 'gym', 'door prize', 'nunes cow', 'nunes', 'gets door', 'prize nunes', 'gym gets']",general,0.0,0.002,1,0.4169034090909091,0.0,0,1,volume_spike_viral_content,"'ORG')(103), [](101), 'ORG')](87), 'PERSON')(60), trump(54)",Nothing significant - no contextually relevant news found for general spike,no_correlation,1,0.0008101691468085828,0,0,0,16,0.8888888888888888
