id,speaker_nm,conversation_id,reply_to_id,reply_to_nm,timestamp,text,likes,shares,num_comments,cleaned_text,named_entities,sentiment,tokens,date,extracted_entities,content_category,enhanced_hate_score,virality_score,spike_day,engagement_rank,hate_intensity,hate_keywords_count,reply_chain_depth,spike_cause,spike_top_entities,spike_external_cause,contextual_relevance,is_reply,user_influence,mention_count,hashtag_count,url_count,conversation_size,conversation_centrality
1336434892977156099,Grey_Obelisk,1336434406035218439,1336434406035218439,thehill,2020-12-08 22:18:02,But what's to become of the remaining $220 million Trump raised to help him fight the election outcome?,5,2,1,whats remaining 220 million trump raised help fight election outcome,"but, help fight, [('$220 million', fight election, become remaining, remaining million, 'MONEY'), trump, million trump, trump raised, election, raised help, 'ORG')], election outcome, ('Trump'",0.0,"[101, 2054, 2015, 3588, 10545, 2454, 8398, 2992, 2393, 2954, 2602, 9560, 102]",2020-12-08,"[""[('$220 million'"", "" 'MONEY')"", "" ('Trump'"", "" 'ORG')]"", 'but', 'help fight', 'become remaining', 'remaining million', 'trump', 'million trump', 'election outcome', 'trump raised', 'election', 'raised help', 'fight election']",politics,0.2,0.013,0,0.7372159090909091,0.2,1,1,normal_activity,,no_spike,none,1,0.008375097334279632,0,0,0,15,0.8333333333333334
1336435375456268291,JDursoCap,1336434406035218439,1336434406035218439,thehill,2020-12-08 22:19:57,"Or 'Supreme Court rejects wanna-be Facism.""",8,0,1,supreme court rejects wannabe facism,"rejects facism, facism, [('Supreme Court', court rejects, 'ORG')], supreme court",0.0,"[101, 4259, 2457, 19164, 10587, 4783, 6904, 22987, 2213, 102]",2020-12-08,"[""[('Supreme Court'"", "" 'ORG')]"", 'court rejects', 'rejects facism', 'supreme court', 'facism']",general,0.0,0.01,0,0.6910511363636364,0.0,0,1,normal_activity,,no_spike,none,1,0.004100700596838173,0,0,0,15,0.8333333333333334
1336435266677067776,drkml1,1336434406035218439,1336434406035218439,thehill,2020-12-08 22:19:31,Law and sanity prevail after all. Extreme relief with this decision.,7,0,0,law sanity prevail extreme relief decision,"[], sanity prevail, law sanity, law, prevail extreme, relief decision, extreme, extreme relief",-0.125,"[101, 2375, 20039, 3653, 3567, 4014, 6034, 4335, 3247, 102]",2020-12-08,"['[]', 'law sanity', 'sanity prevail', 'law', 'prevail extreme', 'relief decision', 'extreme', 'extreme relief']",general,0.1,0.007,0,0.6392045454545454,0.1,0,1,normal_activity,,no_spike,none,1,0.00283559201383004,0,0,0,15,0.8333333333333334
1336435165585764353,Snafu_This,1336434406035218439,1336434406035218439,thehill,2020-12-08 22:19:07,Next stop is the international court in Hague.,4,0,0,stop international court hague,"stop international, next stop, international court, [('Hague', next, 'GPE')], hague, court hague",0.0,"[101, 2644, 2248, 2457, 14575, 102]",2020-12-08,"[""[('Hague'"", "" 'GPE')]"", 'stop international', 'next stop', 'international court', 'next', 'hague', 'court hague']",general,0.0,0.004,0,0.5568181818181818,0.0,0,1,normal_activity,,no_spike,none,1,0.0016203382936171656,0,0,0,15,0.8333333333333334
1336435363829702656,MinisterX2,1336434406035218439,1336434406035218439,thehill,2020-12-08 22:19:55,"Hey Donny, what did the five fingers say to the face?.....",2,1,0,hey donny did fingers say face,"hey donny, donny five, hey, ('five', say face, donny, fingers say, 'CARDINAL')], [('Donny', 'PERSON'), five fingers",0.0,"[101, 4931, 2123, 4890, 2106, 3093, 2360, 2227, 102]",2020-12-08,"[""[('Donny'"", "" 'PERSON')"", "" ('five'"", "" 'CARDINAL')]"", 'hey donny', 'donny five', 'hey', 'say face', 'donny', 'fingers say', 'five fingers']",general,0.0,0.005,0,0.5930397727272727,0.0,0,1,normal_activity,,no_spike,none,1,0.0020701931564124244,0,0,0,15,0.8333333333333334
1336435256631693318,ChuckWagon645,1336434406035218439,1336434406035218439,thehill,2020-12-08 22:19:29,But we had this one. We just had to have it.  MAGA!  Lol,3,0,1,just maga lol,"but, lol, [('MAGA', maga, one maga, maga lol, 'ORG')]",0.8,"[101, 2074, 23848, 2050, 8840, 2140, 102]",2020-12-08,"[""[('MAGA'"", "" 'ORG')]"", 'but', 'lol', 'maga', 'one maga', 'maga lol']",general,0.05,0.005,0,0.5930397727272727,0.05,0,1,normal_activity,,no_spike,none,1,0.0020752777298167157,0,0,0,15,0.8333333333333334
1336445304648810497,DesertHigh52,1336434406035218439,1336434406035218439,thehill,2020-12-08 22:59:25,Pretty sure they expected this. Moving on . . .,1,1,0,pretty sure expected moving,"pretty sure, pretty, [], moving, expected moving, sure expected",0.2166666666666666,"[101, 3492, 2469, 3517, 3048, 102]",2020-12-08,"['[]', 'pretty sure', 'pretty', 'sure expected', 'moving', 'expected moving']",general,0.0,0.004,0,0.5568181818181818,0.0,0,1,normal_activity,,no_spike,none,1,0.0008651085830081329,0,0,0,15,0.8333333333333334
1336450909346390017,johncurtin6,1336434406035218439,1336434406035218439,thehill,2020-12-08 23:21:41,"Nah, they denied the injunctive relief--not the merits of the case. You are not a lawyer, no doubt.",1,1,0,nah denied injunctive reliefnot merits case lawyer doubt,"nah, relief merits, injunctive relief, case lawyer, merits case, nah denied, denied injunctive, lawyer doubt, you, [('Nah', 'PERSON')]",0.0,"[101, 20976, 6380, 1999, 19792, 15277, 4335, 17048, 22617, 2553, 5160, 4797, 102]",2020-12-08,"[""[('Nah'"", "" 'PERSON')]"", 'nah', 'relief merits', 'injunctive relief', 'case lawyer', 'merits case', 'nah denied', 'denied injunctive', 'lawyer doubt', 'you']",general,0.0,0.004,0,0.5568181818181818,0.0,0,1,normal_activity,,no_spike,none,1,0.0016651085830081329,0,0,0,15,0.8333333333333334
1336434967119708160,nomoretrumpery,1336434406035218439,1336434406035218439,thehill,2020-12-08 22:18:20,"LOL

The application for injunctive relief presented to Justice
Alito and by him referred to the Court is denied.",2,0,0,lol application injunctive relief presented justice alito referred court denied,"relief presented, ('Court', alito referred, injunctive relief, referred court, 'ORG'), justice alito, court, ('Alito', presented justice, justice
alito, court denied, 'ORG')], [('LOL', ('Justice', the, lol application, justice, 'PERSON'), application injunctive",0.8,"[101, 8840, 2140, 4646, 1999, 19792, 15277, 4335, 3591, 3425, 4862, 3406, 3615, 2457, 6380, 102]",2020-12-08,"[""[('LOL'"", "" 'ORG')"", "" ('Justice'"", "" 'ORG')"", "" ('Alito'"", "" 'PERSON')"", "" ('Court'"", "" 'ORG')]"", 'alito referred', 'injunctive relief', 'the', 'presented justice', 'referred court', 'justice\nalito', 'lol application', 'justice alito', 'court', 'relief presented', 'court denied', 'justice', 'application injunctive']",social,0.0,0.002,0,0.4169034090909091,0.0,0,1,normal_activity,,no_spike,none,1,0.0008101691468085828,0,0,0,15,0.8333333333333334
1336438871366766593,AltunEvregen,1336434406035218439,1336434406035218439,thehill,2020-12-08 22:33:51,"And now Trump is thinking about what he will do for over 2 hour... Probably he will start preparing for more serious & heavy provocations... Now, what he will spawn instead of fraud, rigged slanders in his every tweet? I'm dicing about will he become much more muddy or not? ",0,1,0,trump thinking 2 hour probably start preparing heavy provocations spawn instead fraud rigged slanders tweet im dicing muddy,"spawn instead, fraud rigged, instead fraud, preparing serious, serious heavy, slanders every, trump thinking, 'TIME')], rigged slanders, trump, every tweet, heavy provocations, thinking hour, probably start, become much, ('over 2 hour', now, dicing become, probably, tweet dicing, [('Trump', much muddy, hour probably, 'PERSON')",0.1166666666666666,"[101, 8398, 3241, 1016, 3178, 2763, 2707, 8225, 3082, 4013, 19152, 2015, 25645, 2612, 9861, 25216, 22889, 12243, 2015, 1056, 28394, 2102, 10047, 4487, 6129, 15405, 102]",2020-12-08,"[""[('Trump'"", "" 'PERSON')"", "" ('over 2 hour'"", "" 'TIME')]"", 'spawn instead', 'hour probably', 'fraud rigged', 'instead fraud', 'preparing serious', 'serious heavy', 'slanders every', 'trump thinking', 'rigged slanders', 'trump', 'every tweet', 'heavy provocations', 'thinking hour', 'probably start', 'become much', 'now', 'dicing become', 'probably', 'tweet dicing', 'much muddy']",politics,0.30000000000000004,0.003,0,0.5035511363636364,0.30000000000000004,1,1,normal_activity,,no_spike,none,1,0.0012600240096038416,0,0,0,15,0.8333333333333334
1336439698949091329,ezautoleasesale,1336434406035218439,1336434406035218439,thehill,2020-12-08 22:37:08,That Law and Order prevailed is no surprise!!  Long live Democracy!!,2,0,0,law order prevailed surprise long live democracy,"long, prevailed surprise, [], law order, order prevailed, democracy, surprise long, order, live democracy, long live, that law",0.0815340909090908,"[101, 2375, 2344, 19914, 4474, 2146, 2444, 7072, 102]",2020-12-08,"['[]', 'long', 'prevailed surprise', 'law order', 'order prevailed', 'democracy', 'surprise long', 'order', 'live democracy', 'long live', 'that law']",general,0.15,0.002,0,0.4169034090909091,0.15,0,1,normal_activity,,no_spike,none,1,0.005171304075679287,0,0,0,15,0.8333333333333334
1336435445807411207,johnnyb312,1336434406035218439,1336434406035218439,thehill,2020-12-08 22:20:14,"@realDonaldTrump
 BRO ITS OVER! #ConcedeNowTrump",1,0,0,realdonaldtrump bro concedenowtrump,"concedenowtrump, realdonaldtrump, [('@realDonaldTrump\n BRO', bro concedenowtrump, trump, #concedenowtrump, bro, realdonaldtrump bro, @realdonaldtrump, 'CARDINAL')], ('#', 'PERSON')",0.0,"[101, 2613, 5280, 19058, 24456, 2361, 22953, 9530, 22119, 19779, 24456, 2361, 102]",2020-12-08,"[""[('@realDonaldTrump\\n BRO'"", "" 'PERSON')"", "" ('#'"", "" 'CARDINAL')]"", 'concedenowtrump', 'realdonaldtrump', 'bro concedenowtrump', 'trump', '#concedenowtrump', 'bro', 'realdonaldtrump bro', '@realdonaldtrump']",politics,0.05,0.001,0,0.30610795454545453,0.05,0,1,normal_activity,,no_spike,none,1,0.0004050845734042914,1,1,0,15,0.8333333333333334
1345888938364383234,thehill,1345888938364383234,0,,2021-01-04 00:25:02,JUST IN: GOP Rep. Chip Roy challenges seating of House members from six presidential battleground states http://hill.cm/uwS7S7y,738,161,35,just gop rep chip roy challenges seating house members presidential battleground states,"six presidential, ('six', house members, 'CARDINAL')], seating house, rep, 'ORG'), ('Chip Roy', ('House', house, states http, gop chip, [('GOP', president, presidential battleground, gop, challenges seating, members six, battleground states, roy challenges, chip roy, 'PERSON')",0.0,"[101, 2074, 2175, 2361, 16360, 9090, 6060, 7860, 10747, 2160, 2372, 4883, 2645, 16365, 2163, 102]",2021-01-04,"[""[('GOP'"", "" 'ORG')"", "" ('Chip Roy'"", "" 'PERSON')"", "" ('House'"", "" 'ORG')"", "" ('six'"", "" 'CARDINAL')]"", 'six presidential', 'gop', 'challenges seating', 'members six', 'battleground states', 'seating house', 'roy challenges', 'rep', 'house', 'house members', 'chip roy', 'president', 'presidential battleground', 'states http', 'gop chip']",politics,0.30000000000000004,1.0,1,0.9822443181818182,0.30000000000000004,1,0,volume_spike_viral_content,"'ORG')(103), [](101), 'ORG')](87), 'PERSON')(60), trump(54)",Nothing significant - no contextually relevant news found for general spike,no_correlation,0,0.5951184406178321,0,0,1,12,0.6666666666666666
1345890397608927235,ThatIsFalse01,1345888938364383234,1345888938364383234,thehill,2021-01-04 00:30:50,"He’s making a point guys.

Read the article.

He’s actually on the side of logic and reason, here.
@chiproytx",28,0,1,hes making point guys read article hes actually logic reason chiproytx,"@chiproytx, logic reason, making point, actually side, [], read article, side logic, reason chiproytx, guys read, point guys, article actually, read",0.0,"[101, 2002, 2015, 2437, 2391, 4364, 3191, 3720, 2002, 2015, 2941, 7961, 3114, 9090, 13238, 2102, 2595, 102]",2021-01-04,"['[]', '@chiproytx', 'actually side', 'making point', 'logic reason', 'read article', 'side logic', 'reason chiproytx', 'guys read', 'point guys', 'article actually', 'read']",general,0.1,0.03,1,0.8110795454545454,0.1,0,1,volume_spike_viral_content,"'ORG')(103), [](101), 'ORG')](87), 'PERSON')(60), trump(54)",Nothing significant - no contextually relevant news found for general spike,no_correlation,1,0.012202392064924,1,0,0,12,0.6666666666666666
1345891014515564544,theschnauzers,1345888938364383234,1345888938364383234,thehill,2021-01-04 00:33:17,"He should do the same motion for every member of his conference that rejects the election of Biden as president, just as his predecessors did in 1861 to Senators and Congressmen who rejected Lincoln’s election.",7,1,1,motion member conference rejects election biden president just predecessors did 1861 senators congressmen rejected lincolns election,"('Lincoln', congressmen rejected, election, senators congressmen, rejected lincoln, ('1861', biden president, biden, conference rejects, every member, predecessors senators, election biden, rejects election, [('Biden', nato, member conference, motion every, lincoln election, president, 'ORG')], lincoln, senators, congressmen, 'GPE'), president predecessors, 'DATE')",0.0,"[101, 4367, 2266, 3034, 19164, 2602, 7226, 2368, 2343, 2074, 16372, 2106, 6863, 10153, 3519, 3549, 5837, 5367, 2015, 2602, 102]",2021-01-04,"[""[('Biden'"", "" 'GPE')"", "" ('1861'"", "" 'DATE')"", "" ('Lincoln'"", "" 'ORG')]"", 'congressmen rejected', 'election', 'senators congressmen', 'rejected lincoln', 'biden president', 'biden', 'conference rejects', 'every member', 'predecessors senators', 'election biden', 'rejects election', 'nato', 'member conference', 'motion every', 'lincoln election', 'president', 'lincoln', 'senators', 'congressmen', 'president predecessors']",politics,0.1,0.012,1,0.7237215909090909,0.1,0,1,volume_spike_viral_content,"'ORG')(103), [](101), 'ORG')](87), 'PERSON')(60), trump(54)",Nothing significant - no contextually relevant news found for general spike,no_correlation,1,0.0049556400330377235,0,0,0,12,0.6666666666666666
1345893327774900227,MaryCMarr1,1345888938364383234,1345888938364383234,thehill,2021-01-04 00:42:29,I am so surprised by this. He's one of the crazies from Texas that has said some crazy crap in the past. He made a valid point and am a little proud of it. Just wish that the House had listened and not sworn them in.,7,0,1,surprised hes crazies texas said crazy crap past valid point little proud just wish house listened sworn,"said crazy, just, crap past, wish house, one crazies, made valid, valid point, ('Texas', 'CARDINAL'), little proud, ('House', house, past made, surprised one, point little, proud wish, crazy crap, house listened, [('one', crazies texas, texas, 'ORG')], texas said, 'GPE'), listened sworn",-0.15625,"[101, 4527, 2002, 2015, 13675, 16103, 2229, 3146, 2056, 4689, 10231, 2627, 9398, 2391, 2210, 7098, 2074, 4299, 2160, 7791, 10741, 102]",2021-01-04,"[""[('one'"", "" 'CARDINAL')"", "" ('Texas'"", "" 'GPE')"", "" ('House'"", "" 'ORG')]"", 'said crazy', 'just', 'crap past', 'wish house', 'one crazies', 'made valid', 'valid point', 'little proud', 'house', 'past made', 'surprised one', 'point little', 'proud wish', 'crazy crap', 'house listened', 'crazies texas', 'texas', 'texas said', 'listened sworn']",general,0.0,0.009,1,0.6725852272727273,0.0,0,1,volume_spike_viral_content,"'ORG')(103), [](101), 'ORG')](87), 'PERSON')(60), trump(54)",Nothing significant - no contextually relevant news found for general spike,no_correlation,1,0.0036956160234338812,0,0,0,12,0.6666666666666666
1345889308968972288,VRValicento,1345888938364383234,1345888938364383234,thehill,2021-01-04 00:26:31,"They're all nuts! GOP House Members shouldn't be seated, if this is how they'll behave.",3,0,0,theyre nuts gop house members shouldnt seated theyll behave,"members seated, seated behave, 'ORG'), nuts gop, gop house, ('House', house members, [('GOP', they, 'ORG')]",0.0,"[101, 2027, 2890, 12264, 2175, 2361, 2160, 2372, 5807, 2102, 8901, 2027, 3363, 16582, 102]",2021-01-04,"[""[('GOP'"", "" 'ORG')"", "" ('House'"", "" 'ORG')]"", 'members seated', 'seated behave', 'nuts gop', 'gop house', 'house members', 'they']",general,0.15000000000000002,0.003,1,0.5035511363636364,0.15000000000000002,0,1,volume_spike_viral_content,"'ORG')(103), [](101), 'ORG')](87), 'PERSON')(60), trump(54)",Nothing significant - no contextually relevant news found for general spike,no_correlation,1,0.0012152537202128743,0,0,0,12,0.6666666666666666
1345891572726910981,nichpic,1345888938364383234,1345888938364383234,thehill,2021-01-04 00:35:31,A hero actually.,3,0,0,hero actually,"[], hero actually",0.0,"[101, 5394, 2941, 102]",2021-01-04,"['[]', 'hero actually']",general,0.1,0.003,1,0.5035511363636364,0.1,0,1,volume_spike_viral_content,"'ORG')(103), [](101), 'ORG')](87), 'PERSON')(60), trump(54)",Nothing significant - no contextually relevant news found for general spike,no_correlation,1,0.0012152537202128743,0,0,0,12,0.6666666666666666
1345891764012519424,ZinaWilson3,1345888938364383234,1345888938364383234,thehill,2021-01-04 00:36:16,It’s going to be a crazy week! Heaven help us! ,2,0,0,going crazy week heaven help,"heaven, [('a crazy week', heaven help, crazy week, 'DATE')], week heaven, going crazy",-0.9375,"[101, 2183, 4689, 2733, 6014, 2393, 102]",2021-01-04,"[""[('a crazy week'"", "" 'DATE')]"", 'heaven help', 'crazy week', 'week heaven', 'heaven', 'going crazy']",general,0.1,0.002,1,0.4169034090909091,0.1,0,1,volume_spike_viral_content,"'ORG')(103), [](101), 'ORG')](87), 'PERSON')(60), trump(54)",Nothing significant - no contextually relevant news found for general spike,no_correlation,1,0.0008101691468085828,0,0,0,12,0.6666666666666666
1345889533523587072,mama4justice,1345888938364383234,1345888938364383234,thehill,2021-01-04 00:27:24,Well ain’t that some shit. The GOP is committing sedition and these mfers wanna unseat dems. Give me a freakin break,1,0,0,aint shit gop committing sedition mfers wanna unseat dems freakin break,"gop, committing sedition, shit gop, the, give, well shit, sedition mfers, unseat dems, give freakin, gop committing, freakin break, [('GOP', mfers wan, well, 'ORG')], dems give, wan unseat",-0.2,"[101, 7110, 2102, 4485, 2175, 2361, 16873, 7367, 20562, 1049, 24396, 10587, 4895, 17310, 2102, 17183, 2015, 11576, 2378, 3338, 102]",2021-01-04,"[""[('GOP'"", "" 'ORG')]"", 'gop', 'shit gop', 'the', 'give', 'well shit', 'sedition mfers', 'unseat dems', 'give freakin', 'gop committing', 'freakin break', 'dems give', 'mfers wan', 'well', 'committing sedition', 'wan unseat']",general,0.0,0.001,1,0.30610795454545453,0.0,0,1,volume_spike_viral_content,"'ORG')(103), [](101), 'ORG')](87), 'PERSON')(60), trump(54)",Nothing significant - no contextually relevant news found for general spike,no_correlation,1,0.0004050845734042914,0,0,0,12,0.6666666666666666
1345959727239467010,vtbirkenstock,1345888938364383234,1345888938364383234,thehill,2021-01-04 05:06:20,I hope he does the same thing on 1/6,1,0,0,hope does thing 16,"hope thing, [('1/6', 'CARDINAL')]",0.0,"[101, 3246, 2515, 2518, 2385, 102]",2021-01-04,"[""[('1/6'"", "" 'CARDINAL')]"", 'hope thing']",general,0.0,0.001,1,0.30610795454545453,0.0,0,1,volume_spike_viral_content,"'ORG')(103), [](101), 'ORG')](87), 'PERSON')(60), trump(54)",Nothing significant - no contextually relevant news found for general spike,no_correlation,1,0.0004050845734042914,0,0,0,12,0.6666666666666666
1346109700689993729,OurRightsCount,1345888938364383234,1345888938364383234,thehill,2021-01-04 15:02:16,"ANY STATE THAT STOPPED COUNTING _ Election night - never happened before - should be challenged, water break, need rest, covid-19 excuses should not be a excuse - who told them too all stop???",0,0,0,state stopped counting election night happened challenged water break need rest covid19 excuses excuse told stop,"rest excuses, excuses excuse, happened challenged, election, told stop, break need, ('covid-19', need rest, 'TIME'), water break, excuse told, state stopped, 'PRODUCT')], challenged water, night never, election night, counting election, stopped counting, [('Election night', never happened",-0.05,"[101, 2110, 3030, 10320, 2602, 2305, 3047, 8315, 2300, 3338, 2342, 2717, 2522, 17258, 16147, 21917, 8016, 2409, 2644, 102]",2021-01-04,"[""[('Election night'"", "" 'TIME')"", "" ('covid-19'"", "" 'PRODUCT')]"", 'challenged water', 'rest excuses', 'excuses excuse', 'need rest', 'night never', 'happened challenged', 'water break', 'election night', 'counting election', 'stopped counting', 'election', 'break need', 'never happened', 'excuse told', 'told stop', 'state stopped']",politics,0.2,0.0,1,0.12428977272727272,0.2,0,1,volume_spike_viral_content,"'ORG')(103), [](101), 'ORG')](87), 'PERSON')(60), trump(54)",Nothing significant - no contextually relevant news found for general spike,no_correlation,1,0.0,0,0,0,12,0.6666666666666666
1345889157147729921,Mankow,1345888938364383234,1345888938364383234,thehill,2021-01-04 00:25:55,And coward Steny Hoyer stopped it,0,0,0,coward steny hoyer stopped,"[('Steny Hoyer', steny hoyer, coward steny, 'PERSON')], and, war, hoyer stopped",0.0,"[101, 16592, 26261, 4890, 7570, 10532, 3030, 102]",2021-01-04,"[""[('Steny Hoyer'"", "" 'PERSON')]"", 'coward steny', 'steny hoyer', 'and', 'war', 'hoyer stopped']",international,0.4,0.0,1,0.12428977272727272,0.4,2,1,volume_spike_viral_content,"'ORG')(103), [](101), 'ORG')](87), 'PERSON')(60), trump(54)",Nothing significant - no contextually relevant news found for general spike,no_correlation,1,0.0,0,0,0,12,0.6666666666666666
1345890430190235648,aanalyst50,1345888938364383234,1345888938364383234,thehill,2021-01-04 00:30:58,Chip’s s nut job like Trump is.,0,0,0,chips s nut job like trump,"job like, like trump, chip, [('Trump', nut job, trump, chip nut, 'PERSON')]",0.0,"[101, 11772, 1055, 17490, 3105, 2066, 8398, 102]",2021-01-04,"[""[('Trump'"", "" 'PERSON')]"", 'job like', 'like trump', 'chip', 'nut job', 'trump', 'chip nut']",politics,0.0,0.0,1,0.12428977272727272,0.0,0,1,volume_spike_viral_content,"'ORG')(103), [](101), 'ORG')](87), 'PERSON')(60), trump(54)",Nothing significant - no contextually relevant news found for general spike,no_correlation,1,0.0,0,0,0,12,0.6666666666666666
1346187188376055809,thehill,1346187188376055809,0,,2021-01-04 20:10:11,"Civil rights group sues Proud Boys over ""racist attack"" on DC church http://hill.cm/kemW8Y8",281,63,31,civil rights group sues proud boys racist attack dc church,"attack church, rights, sues proud, attack, [('Proud', group sues, civil, proud boys, rights group, church http, ('DC', 'PERSON')], 'GPE'), boys racist, 'PERSON'), ('http://hill.cm/kemW8Y8', civil rights, racist attack",0.8,"[101, 2942, 2916, 2177, 9790, 2015, 7098, 3337, 16939, 2886, 5887, 2277, 102]",2021-01-04,"[""[('Proud'"", "" 'PERSON')"", "" ('DC'"", "" 'GPE')"", "" ('http://hill.cm/kemW8Y8'"", "" 'PERSON')]"", 'attack church', 'rights', 'sues proud', 'attack', 'group sues', 'civil', 'proud boys', 'rights group', 'church http', 'boys racist', 'civil rights', 'racist attack']",terrorism,0.2,0.532,1,0.9502840909090909,0.2,1,0,volume_spike_viral_content,"'ORG')(103), [](101), 'ORG')](87), 'PERSON')(60), trump(54)",Nothing significant - no contextually relevant news found for general spike,no_correlation,0,0.5951184406178321,0,0,1,15,0.8333333333333334
1346188683209179137,AntiECollege,1346187188376055809,1346187188376055809,thehill,2021-01-04 20:16:07,Their name says it all. Proud as in too proud to be intelligent.  Boys not Men.,4,0,0,says proud proud intelligent boys men,"their, proud, [], intelligent boys, says proud, proud proud, men, proud intelligent, boys men, name says, boys",0.8000000000000002,"[101, 2758, 7098, 7098, 9414, 3337, 2273, 102]",2021-01-04,"['[]', 'their', 'intelligent boys', 'boys', 'says proud', 'proud proud', 'men', 'proud intelligent', 'boys men', 'name says', 'proud']",general,0.1,0.004,1,0.5568181818181818,0.1,0,1,volume_spike_viral_content,"'ORG')(103), [](101), 'ORG')](87), 'PERSON')(60), trump(54)",Nothing significant - no contextually relevant news found for general spike,no_correlation,1,0.0016203382936171656,0,0,0,15,0.8333333333333334
1346188471946403841,BigLdaGod,1346187188376055809,1346187188376055809,thehill,2021-01-04 20:15:17,All they got to give is pocket lint and hamburger wrappers.....,2,0,0,got pocket lint hamburger wrappers,"[], all, pocket lint, hamburger wrappers, lint hamburger, got give, give pocket",0.0,"[101, 2288, 4979, 11409, 2102, 24575, 10236, 7347, 102]",2021-01-04,"['[]', 'pocket lint', 'all', 'hamburger wrappers', 'lint hamburger', 'got give', 'give pocket']",general,0.1,0.002,1,0.4169034090909091,0.1,0,1,volume_spike_viral_content,"'ORG')(103), [](101), 'ORG')](87), 'PERSON')(60), trump(54)",Nothing significant - no contextually relevant news found for general spike,no_correlation,1,0.0008101691468085828,0,0,0,15,0.8333333333333334
1346189951457763328,dobrock,1346187188376055809,1346187188376055809,thehill,2021-01-04 20:21:10,"this photo is like, the worst version of suicide squad.",2,0,0,photo like worst version suicide squad,"suicide squad, [], worst version, version suicide, photo like, like worst",-1.0,"[101, 6302, 2066, 5409, 2544, 5920, 4686, 102]",2021-01-04,"['[]', 'suicide squad', 'worst version', 'version suicide', 'photo like', 'like worst']",general,0.0,0.002,1,0.4169034090909091,0.0,0,1,volume_spike_viral_content,"'ORG')(103), [](101), 'ORG')](87), 'PERSON')(60), trump(54)",Nothing significant - no contextually relevant news found for general spike,no_correlation,1,0.0008101691468085828,0,0,0,15,0.8333333333333334
